id,post_id,timestamp,author,text,score,subreddit
jboqdtf,11nm65s,2023-03-10 15:51:51,Beznia,[Source](https://youtu.be/dvYvQeNeq3A?t=27),33,wallstreetbets
jbori8n,11nrlmw,2023-03-10 15:59:10,jokull1234,Incompetency buying long term bonds at close-to-zero rates that was amplified by their clients (startups) needing to pull money out requiring SVB to realize their losses on the secondary bond market instead of holding to maturity.,169,investing
jboroqz,11nm65s,2023-03-10 16:00:20,novab792,Is Ally in trouble?,6,wallstreetbets
jborpi3,11nm65s,2023-03-10 16:00:28,daynighttrade,"He did, when it was at 330",20,wallstreetbets
jbosg4d,11n5f70,2023-03-10 16:05:19,No-Emotion-7053,"Lmao 😂 love this joke, thanks for reminding me",2,investing
jbotii3,11n5f70,2023-03-10 16:12:12,MJinMN,"The banks disclose the value of their bond portfolios every quarter in their 10-Q, it's not a secret.  If the banks are classified as ""held for sale"", which is most common, the decline in value is already reflected in the bank's equity.  So, it's not like there are huge unquantifiable losses that investors have no idea about from the outside - everything is disclosed and the held for sale portfolios are marked to market.",1,investing
jbou730,11nm65s,2023-03-10 16:16:38,WatchingyouNyouNyou,Appropriate lol,1,wallstreetbets
jboummw,11nrlmw,2023-03-10 16:19:27,DontTryAndStopMe,Cant wait until JPMC or another giant swoops in to be the savior and buy them at a 70% discount and the too big to fail becomes even bigger to failier,277,investing
jbov2op,11n5f70,2023-03-10 16:22:20,WTD_Ducks21,"Yup. And this is what happened to silver gate as well. Crypto price tanked, investors cashed out, and they had to sell a bunch of 10 year treasuries at a significant loss. Now the worry is that many banks are facing the same risk.",2,investing
jbov4nn,11nb9f4,2023-03-10 16:22:40,Xenon2212,"Lmao the CEO really went on the call and said ""trust me bro""",5,wallstreetbets
jbowcmy,11nrlmw,2023-03-10 16:30:32,gravescd,Sad times when a bank has to resort to selling itself on The Street,98,investing
jbowl87,11nm65s,2023-03-10 16:32:04,legbreaker,"Free cash has made the business plan of burning money for years become the norm.

Now it’s suddenly put up or shut up. Profitability in 12 months or die.",64,wallstreetbets
jbowmlr,11nrlmw,2023-03-10 16:32:19,SeymourButzMD,"It's hilarious because I read a note early this morning from an analyst urging investors to buy the stock at this ""highly attractive valuation""",56,investing
jbowzuj,11nm65s,2023-03-10 16:34:45,tranqfx,This hit home...,1,wallstreetbets
jbox6sa,11myayr,2023-03-10 16:36:01,Beavis2210,"You realize the difference between their Venture Lending side and their M&amp;A side, right?  

The M&amp;A side can rot.",1,stocks
jboxkb6,11nb9f4,2023-03-10 16:38:24,Noominami,Oh well I sure hope so. 😅 my misunderstanding,2,wallstreetbets
jboxs7o,11nb9f4,2023-03-10 16:39:48,on_Jah_Jahmen,Seems like you dont understand the big picture. Free money and loss of productivity from covid era policies were what set everything off.,4,wallstreetbets
jboxz57,11nrlmw,2023-03-10 16:41:01,cookingboy,"We are talking about completely different issues.

There is a difference between non-profitability and illiquidity from losing access to all your cash from your bank account. 

&gt;	A bunch of Silicon Valley startups are about to get culled 

I think there is a chance that many non-Cashflow positive companies will have trouble raising new rounds to extend runways, thus leading to them closing shop. 

But that is very different from companies having their runway taken from them due to the bank they store their cash in going bankrupt. What you are saying may be true, but is completely orthogonal to this news.",3,investing
jboyf5j,11myayr,2023-03-10 16:43:51,smallchats,"Noob here. Can someone explain to me the dynamics of SVB selling their US Treasuries when Fed raised interest rates?

Is it b/c the rising interest rates causes the US Treasury prices to decline and SVB felt the need to protect their investment before the price dropped further?

Appreciate it!",1,stocks
jboym90,11nm65s,2023-03-10 16:45:05,GoingDeezNuts,"This is exactly correct.  When yields are 0% people will buy ANYTHING.   stocks, crypto, nfts, etc. 


At 5% they'll just take the interest.   

In 2020 I predicted that 80% of the SP500 will not exist by 2030 in its current form.  There will be mergers, acquisitions, taking companies private, etc.  But there will also be bankruptcies and LOTS of them.  

These companies are so overleveraged that at 5% they are scrambling.   Inflation is so high that rates need to be closer to 10%.   They're all meat at that point and they don't have any equity buffer because the idiots repurchased all their shares.  They can't borrow because they are already filled to the gills with debt they can barely service. 

It's all over but the crying.",35,wallstreetbets
jboz6qh,11nm65s,2023-03-10 16:48:43,legbreaker,"Rich white men crying is not to be joked about though.

They tend to get bailouts even if their behavior and share repurchases were completely reckless.",8,wallstreetbets
jbozkgl,11n5f70,2023-03-10 16:51:05,7366241494,"Not always no. I have personally had an investor decline getting their money back, and someone I know had their $60m exit scuppered _on signing day_ by their VC who wanted to wait for a silly valuation.

Congrats on being part of one startup but just because it didn’t happen to you doesn’t mean it doesn’t happen. It’s certainly not “nonsense.”",3,investing
jbozt0o,11nb9f4,2023-03-10 16:52:36,Moist-Barber,Can someone explain to this regard why this matters or why I should care,2,wallstreetbets
jbp023i,11nrlmw,2023-03-10 16:54:11,gsasquatch,"Moral hazard, and not big enough to not fail.

VC or money in general will be harder to come by, and that is going to be what actually recessions us.    Works well for the big who will have less little scrappy startups to fend off,  and it is the big who the government represents.     

Greenspan got paid more than a year's salary for 1 speech at Lehman Bros a week after he stepped down.    Is SVB paying for those speeches?",6,investing
jbp03r8,11nrlmw,2023-03-10 16:54:28,mulemoment,To be fair it's probable the buy out happens at a higher valuation than whatever it was panic sold to this morning. edit:obviously not anymore,6,investing
jbp0qsn,11nrlmw,2023-03-10 16:58:28,texashooligan,They gone.,27,investing
jbp0t8k,11nrlmw,2023-03-10 16:58:54,posam,"This seems more of a liquidity issue than anything else. They have significant long dated assets. They won’t be able to liquidate them quickly enough though and when they do, they will incur large losses but I don’t think anyone here could say how big a drop from their carrying value we would see.

10 year treasury yields look to be not quite double what SVB has on their 10-K",21,investing
jbp16tz,11nrlmw,2023-03-10 17:01:17,thekingoftherodeo,"And that's that.

Bit of a Lehmann moment for tech financing.",23,investing
jbp175g,11nrlmw,2023-03-10 17:01:20,fartmouthbreather,Game is over as of a few minutes ago.,20,investing
jbp17ds,11n5f70,2023-03-10 17:01:23,lost_in_life_34,cramer too,1,investing
jbp1pnu,11n5f70,2023-03-10 17:04:42,maztron,"Agreed. Not sure what type of regulations this particular type of bank needs to follow, but seeing that it looks to be more of an investment firm they didn't need to be well capitalized.  Pardon if I'm using all the wrong terms in describing their banking model.",1,investing
jbp1t26,11n5f70,2023-03-10 17:05:18,anish714,Good.  Close the Zombie companies down.  At least those that has no  viable path to profitability.,2,investing
jbp27h3,11n5f70,2023-03-10 17:07:52,lost_in_life_34,"around a year ago they bought a bunch of long term treasuries when rates were lower and prices higher. 30 year and maybe slightly shorter term ones. Now that inflation has been roaring and the fed raising short term rates the long term rates went up as well due to inflation. the value of the treasuries has dropped even though they are still getting paid interest.

&amp;#x200B;

but due to regulations I think they have to take the value into account on their assets and find more cash to meet FDIC and other banking regulations for asset to liabilities ratios",1,investing
jbp2ceb,11n5f70,2023-03-10 17:08:44,lost_in_life_34,i bet he's looking to buy them on the cheap,2,investing
jbp2mbb,11nrlmw,2023-03-10 17:10:28,nickname7788,"Those kind of processes take years, many of the startups will not survive the year if something like this happens. For example Lehman Brothers paid 105 billion to their unsecured depositors in 2016, 8 years after they have collapsed.",5,investing
jbp31gq,11nrlmw,2023-03-10 17:13:11,Dachannien,"Hold on, let me check my couch cushions...",1,investing
jbp31xp,11nrlmw,2023-03-10 17:13:16,dragontamer5788,"Well, that's what is happening, right now. So tough shit.

https://www.fdic.gov/news/press-releases/2023/pr23016.html",3,investing
jbp43xs,11nrlmw,2023-03-10 17:20:06,SystemicScrew,"American regulator FDIC (Federal Deposit Insurance Corporation) and California banking authorities are taking over the SVB Financial Group‘s Silicon Valley Bank, reports say.

[https://economictimes.indiatimes.com/news/international/business/california-regulator-shuts-silicon-valley-bank-appoints-fdic-as-receiver/articleshow/98549698.cms?from=mdr](https://economictimes.indiatimes.com/news/international/business/california-regulator-shuts-silicon-valley-bank-appoints-fdic-as-receiver/articleshow/98549698.cms?from=mdr)",60,investing
jbp472c,11nrlmw,2023-03-10 17:20:39,serbeardless,My guess is the buyer will be from Saudi Arabia.,-3,investing
jbp57hv,11myayr,2023-03-10 17:27:02,throwaway43234235234,"Stopped now. They didn't find a chair in time.   
 https://www.cnbc.com/2023/03/10/silicon-valley-bank-is-shut-down-by-regulators-fdic-to-protect-insured-deposits.html",3,stocks
jbp5ezy,11nrlmw,2023-03-10 17:28:20,LambdaLambo,Well we got something even worse,22,investing
jbp5jtq,11n5f70,2023-03-10 17:29:11,josiahlo,"FDIC already took it over,  they’re done",1,investing
jbp5k9x,11nm65s,2023-03-10 17:29:15,macksters,"No bailouts, just your good ole free market. Returns always have a risk. 👍",7,wallstreetbets
jbp5kyr,11nb9f4,2023-03-10 17:29:22,Ok-Assistance-2723,"Bankrupt, more like gone entirely.",5,wallstreetbets
jbp5xnb,11myayr,2023-03-10 17:31:37,accountingisaccrual,I have 3 shares to sell you,7,stocks
jbp606m,11nm65s,2023-03-10 17:32:04,Alec_NonServiam,"Highly doubt it. They are heavy on auto lending, not treasuries.

SVB got fucked because of their unique VC deposit scheme, VC's wanted to pull their money. But SVB, being totally regarded, bought long treasuries with their deposit funds. How are long treasuries doing? Take a look at TLT and you'd have an answer. If VC's pull deposits, SVB must then realize the loss on those bonds.

Most banks do not make heavy long treasury plays on funds they need liquid.",23,wallstreetbets
jbp6bg2,11nrlmw,2023-03-10 17:34:06,Sunny_Hill_1,Guess nor worth the trouble then,1,investing
jbp6l77,11nrlmw,2023-03-10 17:35:51,borkyborkus,Just got an email that CA dept of financial protection just closed the bank.,62,investing
jbp6qbr,11nrlmw,2023-03-10 17:36:45,2tofu,paging Warren Buffet,7,investing
jbp6shy,11nrlmw,2023-03-10 17:37:08,DevilishlyAdvocating,My payroll was impacted today because our vendor used SVB. Said they would be delayed while they switch to JPM.,11,investing
jbp78lf,11nb9f4,2023-03-10 17:39:58,OriginalOpulance,"You don’t get a golden parachute when your assets get seized by the government.

Banks should be lending to startups, that’s how our system functions. Their lending practices had little to nothing to do with their collapse. They collapsed due to liquidity risk because of losses on a “risk-free” bond portfolio.",1,wallstreetbets
jbp7lbp,11nrlmw,2023-03-10 17:42:14,ig226,"Do you know with FDIC, how soon do you get your money back? What if someone was using this bank to store down payment and was going to close soon.",3,investing
jbp7pok,11nb9f4,2023-03-10 17:43:01,DangerStranger138,![img](emote|t5_2th52|29637)![img](emote|t5_2th52|29093)![img](emote|t5_2th52|4271),2,wallstreetbets
jbp7scf,11nrlmw,2023-03-10 17:43:29,Gary3425,"No chance, not anymore. It's zero.",11,investing
jbp7wp2,11nrlmw,2023-03-10 17:44:16,Gary3425,"Definitely not fraud from the facts we know now. Things happen, banks fail.",8,investing
jbp7zfj,11nrlmw,2023-03-10 17:44:45,habitualtroller,I read insured customers can get to their cash on Monday.,4,investing
jbp8800,11nrlmw,2023-03-10 17:46:16,Gary3425,"He is staying a million miles away on this one. However, if some other banks start to suffer, he could step in for sure.",11,investing
jbp881f,11nrlmw,2023-03-10 17:46:17,macnamaralcazar,I just saw this https://www.nbcnews.com/news/amp/rcna74311,17,investing
jbp8owd,11nrlmw,2023-03-10 17:49:17,mp0295,"What are you talking about toxic MBS?

This has nothing to do with MBS

This is just that fixed-rate bond values go down when interest rates go up.  This is true for any fixed rate bond (i.e. 99% of bonds).

They could have been holding long dated treasuries, and this would have happened too.

Do you believe all bonds are toxic?  Their issue was poor liquidity managment.",30,investing
jbp8qog,11nm65s,2023-03-10 17:49:37,GoingDeezNuts,I mean don't look now but auto loan defaults are already higher than they were at their peak in 2009. And the layoffs haven't even really started yet...,7,wallstreetbets
jbp95wy,11n5f70,2023-03-10 17:52:20,Crackertron,"Great, let's give that Nazi more leverage over SV.",1,investing
jbp9wuo,11nm65s,2023-03-10 17:57:06,Alec_NonServiam,"You can look at Ally's 10Q and annual report for 2022, just came out like two weeks ago. Loan loss provision is budgeted for, but if you think they're gonna eat shit you could always load up on puts. That would basically be the easiest analog to short the auto loan market since that's most of what they do.",7,wallstreetbets
jbpa0yb,11nrlmw,2023-03-10 17:57:49,iFunnyGopher,I have a bigger concern about the big financial institutions holding treasuries if we miss that interest payment later in the year,1,investing
jbpb30h,11nrlmw,2023-03-10 18:04:38,NeuralNexus,"It *was* probable. 

Now it’s a 0. There’s no business left. The banking regulators took all the money and all the assets so the business of SVB is no longer existent.",26,investing
jbpbacw,11nb9f4,2023-03-10 18:05:57,Alec_NonServiam,"She's dead, Jim.",3,wallstreetbets
jbpbkek,11nrlmw,2023-03-10 18:07:46,purplebrown_updown,What’s the ramifications of this? Will we see a chain reaction ? If so what’s immediately affected?,4,investing
jbpbon3,11n5f70,2023-03-10 18:08:31,mistressbitcoin,I would imagine those are not the majority of the ones large banks hold.,1,investing
jbpbw88,11nm65s,2023-03-10 18:09:53,wefarrell,"That's a good sign for SVB depositors right? Those treasuries should be pretty easy to liquidate so accounts over the FDIC limit should get their money back, right?

Asking for a friend.",3,wallstreetbets
jbpcbkc,11nm65s,2023-03-10 18:12:40,Ok-Lawfulness-5739,Its here. It has come. The “Great Unraveling”. Its a confirmed Financial Contagion and Global Crisis. The Feds are halting trading to slow it down. Financial TV trying to calm everyone down to lessen the coming national bank run on cash withdrawals.,-2,wallstreetbets
jbpcc24,11n5f70,2023-03-10 18:12:46,OfficialHavik,"So.... WTF, 2008 again?",1,investing
jbpd5tr,11nm65s,2023-03-10 18:18:06,Alec_NonServiam,"That's anyone's guess. I don't know how deep the rabbit hole goes with SVB, my experience is with non-VC banks. If they were smart, they bought swaps on those long treasuries when the Fed called the rate hikes incoming Jan of '22. It wasn't like they were devalued overnight, they would have had time. The reinsurance market is a black box, though. Who the fuck knows until FDIC makes a statement.",3,wallstreetbets
jbpdyt0,11nm65s,2023-03-10 18:23:20,mylowerbackhurts,Pauly D tried to warn us,5,wallstreetbets
jbpeblj,11nm65s,2023-03-10 18:25:36,Ok-Lawfulness-5739,Just a tip you guys… my insider friend advised to withdraw a bunch of cash. The national bank run is coming. They will pause withdrawals. ✅👍,-5,wallstreetbets
jbpf2n1,11nm65s,2023-03-10 18:30:29,cashflowamasters,"I'm not sure your S&amp;P 500 companies are at risk.  Some are, Coca Cola, Microsoft, Bank of America, NVIDIA, etc. will be fine.  It's your small cap stocks that are more at risk.",14,wallstreetbets
jbpf45t,11nrlmw,2023-03-10 18:30:45,JLARGE53,"SVB has about $65B of residential MBS on their books. MBS is considered high quality collateral. It has a lot to do with MBS and all other bonds. If any banks are forced to sell those, that directly drives up mortgage rates. Not to mention the Fed has a shit ton of them, too.",5,investing
jbpftif,11nu4pb,2023-03-10 18:35:22,ProcessMeMrHinkie,"Got it on treasuries, but didn't they need to report loss **because** they had to sell and weren't liquid enough to wait to repay? Buying treasuries shouldn't yield losses (aside from inflation) unless the US goes tits up?",1,wallstreetbets
jbpfyud,11nu4pb,2023-03-10 18:36:18,waerrington,"SVB is extremely well known in the tech and VC industries. Startups use them, founders use them, VCs use them, lots of employees even. They made it very easy to bank for people with lumpy, non-traditional, and equity-heavy compensation packages that normal banks wouldn't touch.",3,wallstreetbets
jbpfzs5,11nu4pb,2023-03-10 18:36:28,ya_mashinu_,They will almost surely want to slow and assess the risk to other banks.,1,wallstreetbets
jbpfzv1,11nu4pb,2023-03-10 18:36:29,tjonesmachine93,"Why would he need to sell an asset? He already has debt at the bank that’s just gonna get sold to someone else. He just needs to find funding for the rest of the project, no?",1,wallstreetbets
jbpg38a,11nrlmw,2023-03-10 18:37:05,Skadi793,"SBV was holding a lot of MBS and had them marked to maturity, or so I understand

Some of these things had like 1.8% yields on them, and are now worth next-to-nothing. When the run started, and SBV was furiously selling treasuries, MBS, and other assets, they were taking massive losses

like 2008 all over again",-5,investing
jbpg3du,11nu4pb,2023-03-10 18:37:07,jedklampet,SVB = Enron,1,wallstreetbets
jbpg6cn,11nu4pb,2023-03-10 18:37:39,tedfor,[https://infomemo.theocc.com/infomemo/search](https://infomemo.theocc.com/infomemo/search),2,wallstreetbets
jbpg6do,11nu4pb,2023-03-10 18:37:39,Froggyboy17,You missed the sarcasm,2,wallstreetbets
jbpg84x,11nu4pb,2023-03-10 18:37:59,azurephoenix_,"We’re way past the point of needing a civil war, I agree. Keep stealing elections and we’ll get one sooner or later.",-1,wallstreetbets
jbpg9sv,11nu4pb,2023-03-10 18:38:17,supremesamurai,"But my super left leaning friend says this only impacts the rich, so fuck them! /s",1,wallstreetbets
jbpgazx,11nu4pb,2023-03-10 18:38:30,DondeEstaBiblioteca9,That's nice,0,wallstreetbets
jbpgcmx,11nu4pb,2023-03-10 18:38:47,tjonesmachine93,"Different question, why would anyone deposit more than FDIC limits in any bank other than one of the “too big too fail” banks? Guess that’s the reason why BofA is paying 0.03% still and Momandpop bank is paying 3.49%.",1,wallstreetbets
jbpgd6q,11nu4pb,2023-03-10 18:38:53,lollipopsweater,Yeah - you'll be fine. Some other comments have linked that puts are made whole at the maximum possible value.,1,wallstreetbets
jbpgdqs,11nu4pb,2023-03-10 18:38:59,Hacking_the_Gibson,Good. Then this liquidity crunch should put the brakes on inflation.,1,wallstreetbets
jbpgfox,11nu4pb,2023-03-10 18:39:20,TianObia,What big lender pulled out of the SVB that caused this? Regarded takes only,1,wallstreetbets
jbpgjnl,11nm65s,2023-03-10 18:40:02,DodgeBeluga,That’s like asking does Will Smith like to go shirtless in his movies.,2,wallstreetbets
jbpglny,11nu4pb,2023-03-10 18:40:24,ankole_watusi,"Ah, the OC.

Is this one of the reasons Irvine turned up near the top of a “happiest places to live” list?

I was struggling to think of a single reason.",1,wallstreetbets
jbpgq5h,11nu4pb,2023-03-10 18:41:12,TianObia,Major lender pulled out of the bank,1,wallstreetbets
jbpgqvu,11nm65s,2023-03-10 18:41:20,DodgeBeluga,"The ostriches are all still parroting the same “my company is still hiring, this is fine.”


They don’t understand the concept of keeping an ad open to justify H-visas.",3,wallstreetbets
jbpgqyr,11nu4pb,2023-03-10 18:41:21,reverie,"There’s nothing localized about the overall tech sector. While there will be local impact (some bay area mortgages and wineries for example), the impact of this is global. 

Payroll, venture debt, and then cascading second and third degree failures with some companies relying on others that had a loan with SVB. Most can’t just pay back a loan immediately so guess what happens to the company. 

And then there’s China…",1,wallstreetbets
jbpgywb,11n5f70,2023-03-10 18:42:48,rjsheine,Is that bad,1,investing
jbph4c4,11nu4pb,2023-03-10 18:43:46,d4ng3rz0n3,any examples you can provide?,1,wallstreetbets
jbph4g1,11nu4pb,2023-03-10 18:43:47,Trees_feel_too,Silverton,1,wallstreetbets
jbph76l,11nrlmw,2023-03-10 18:44:17,LonleyBoy,"Nothing like 2008. 

Back then the MBS’s were worthless because the default rates of the underlying mortgages were going up. 

Now, they are still performing and paying their investors the interest payments. It is just that the value of the bond itself is lower because the paying rate is below current interest rates. 

The MBS are NOT worth “next to nothing”. That is not true. They are trading at 80-85 right now. 

Very different scenarios and there is nothing toxic about these assets.

Edit: the outcome would be identical for SBV if that money had been invested in 10 year Treasuries versus MBS. The instrument didn’t matter in this case, it was the long maturity of them.",11,investing
jbph9ak,11nrlmw,2023-03-10 18:44:40,mp0295,"I certainly don't disagree with you.  I was mainly attacking the implication of the guy I was responding that the issue was MBS bonds defaulting (like in 2008), which is not the case at all",3,investing
jbphcvm,11nu4pb,2023-03-10 18:45:19,AshingiiAshuaa,"It appears I cashed in my puts too soon.  :/

Reload puts?  Buy TLT?  Both?",1,wallstreetbets
jbphd16,11nu4pb,2023-03-10 18:45:20,TPL531,Good points,1,wallstreetbets
jbphfm9,11nu4pb,2023-03-10 18:45:48,TheCaspica,"Don't get me wrong, it *is* a big deal for California and the US. It's however not as intertwined with the rest of the world as the multinational banks that crashed -08. I see a lot of comparisons to it but they're not really similar.",1,wallstreetbets
jbphfz3,11n5f70,2023-03-10 18:45:52,Wisesize,"Jesus christ, they just made bank",2,investing
jbphgr0,11nu4pb,2023-03-10 18:46:01,Neil_Hodgkinson,"Aw yeah, heard a few friends under Silverton got laid off already this morning. I’m sorry friend.",2,wallstreetbets
jbphkdf,11nu4pb,2023-03-10 18:46:40,conviper30,Holy fuck the amount of money people made must be insane,1,wallstreetbets
jbphlrz,11nm65s,2023-03-10 18:46:55,MonaMonaMo,Can't afford to print money in this inflationary period,2,wallstreetbets
jbphmey,11nqfsm,2023-03-10 18:47:02,FiveHundyByMidnight,Can someone please explain to me what will happen with the shares I own in this company?? Explain it to me like I’m 5.,10,wallstreetbets
jbphn4d,11nu4pb,2023-03-10 18:47:10,Youngerdiogenes,Gold. Thank you,1,wallstreetbets
jbphoy7,11nu4pb,2023-03-10 18:47:29,meeetttt,Ok Cesar Sayoc,0,wallstreetbets
jbphqwj,11nu4pb,2023-03-10 18:47:50,i_wave_to_koalas,"Nothing really, their holding in svb accounts for around 0.6% to 0.7%  of their total portfolio.",1,wallstreetbets
jbphqyl,11nqfsm,2023-03-10 18:47:51,ProcessMeMrHinkie,Nothing to see here SEC,23,wallstreetbets
jbphszm,11nrlmw,2023-03-10 18:48:12,JLARGE53,"I think it's more incompetency in who they chose to bank with. Almost all banks had to buy garbage-yielding bonds. But they're forced to - they can only hold certain types of assets that qualify as ""good"" collateral/reserves. Fortunately, most big banks have a diverse enough client base that they shouldn't see a huge run. But they're gonna have to up their deposit rates pretty quick or more people are going to flee for better yields elsewhere.",11,investing
jbphxg5,11nqfsm,2023-03-10 18:49:00,Outrageous-Onion1991,"And this is just one case. Imagine how much tax payers money has benefited corps, banks, multinationals, just about anything other than investing in US citizens. Infrastructure, healthcare, education, manufacturing etc has all been crumbling in this country. Yeah, retail generates a lot of money, but that can only go so far. The amount of information and resources Americans have we should have allowed things to get this bad 😞",5,wallstreetbets
jbphy55,11nrlmw,2023-03-10 18:49:08,mp0295,"Sorry but no, its completely different. The issue in 2008 was defaults of CDOs of non-agency RMBS bonds.

These are agency MBS bonds, which are AAA and money good. This has nothing to do with MBS specifically really.  MBS just ""happened"" to the type of fixed-rate bond they were holding

SVB's portfolio of MBS could have been entirely in US Treasuries (*that had a similar mod dur*), and the same thing would have happened. 

The only commonality is the liquidity issue.",4,investing
jbphyqa,11nrlmw,2023-03-10 18:49:14,Tacoman_2500,How so?,5,investing
jbpi1e5,11nrlmw,2023-03-10 18:49:42,mp0295,Yup. People are always chasing the last crisis...,4,investing
jbpi20k,11nu4pb,2023-03-10 18:49:49,TheIncredibleNurse,Call your moms regards!!!,1,wallstreetbets
