id,post_id,timestamp,author,text,score,subreddit
jbsibft,11nuooj,2023-03-11 10:48:53,hamilkwarg,It seems like svb was a special case of having clients that mostly had large accounts and all got the same message to pull their funds. Most other banks aren’t going to have such concentrated clientele type that move in such a coordinated fashion to cause such a bank run. SVB just seemed very combustible in this way.,1,investing
jbsidmr,11ny41q,2023-03-11 10:49:44,therocketofpoop,What happened is peter thiel started a bank run - he's vewwy quiet wight now. We'll know more later. But you heard it here first.,5,wallstreetbets
jbsig5t,11o2whf,2023-03-11 10:50:45,netcoder,"The irony is free, though.",2,finance
jbsipp7,11nnhzg,2023-03-11 10:54:28,Wired_Jester,Just one more pump and dump checked off his list.,1,wallstreetbets
jbsiyiq,11o47qi,2023-03-11 10:57:59,zulu1239,"Because your question isn’t even worth a response it’s so dumb. 

https://www.google.com/search?q=why+do+businesses+hold+cash&amp;source=hp&amp;ei=WV4MZMjVO9eVxc8Po-mfmAw&amp;oq=why+do+businesses+hold+cash&amp;gs_lcp=ChFtb2JpbGUtZ3dzLXdpei1ocBADMgYIABAWEB4yBQgAEIYDMgUIABCGAzIFCAAQhgMyCAghEBYQHhAdMggIIRAWEB4QHToLCAAQgAQQsQMQgwE6CwguEIAEELEDENQCOgUIABCABDoFCC4QgAQ6DgguELEDEIMBEMcBENEDOggIABCxAxCDAToFCAAQsQM6CwguEIAEELEDEIMBOggILhCABBCxAzoUCC4QgAQQsQMQgwEQxwEQ0QMQ1AI6DgguEIAEELEDEIMBENQCOgQIABADOgsILhCABBDHARCvAToICC4QgAQQ1AI6BwgAEIAEEAo6CAgAEBYQHhAPOgUIIRCgAToGCAAQHhANUK4HWJY9YPpMaAJwAHgBgAGJAogBuCiSAQYwLjI4LjOYAQCgAQGwAQA&amp;sclient=mobile-gws-wiz-hp",3,stocks
jbsj0we,11nvd4e,2023-03-11 10:58:54,lawfull13,"Classic wallstreet bets grammar. 

Rest in peace        in peace..

Love it",1,wallstreetbets
jbsjmrt,11o0tg3,2023-03-11 11:07:29,Right-Shopping9589,![img](emote|t5_2th52|12787),7,wallstreetbets
jbsjv9j,11nu4pb,2023-03-11 11:10:42,Tacoslocos2000,Clean explanation. Thanks,1,wallstreetbets
jbsk2zn,11nuooj,2023-03-11 11:13:39,lunchbox-g,Explain,2,investing
jbsk491,11nvd4e,2023-03-11 11:14:09,Suspicious_Loads,Actually SVB where good but got messed up by fed lowering bond value combined with a bank run. They didn't do anything bad and risky.,1,wallstreetbets
jbsk5hx,11o47qi,2023-03-11 11:14:36,ForwardInstance,"If anything, in this entire debacle, the only thing people are confident about is getting their 250K from FDIC. No one knows or trusts what’s going to happen to the rest of the funds (timeline, haircut) as the asset sale and insurance are all up in the air right now",1,stocks
jbskeaf,11o47qi,2023-03-11 11:18:00,nutbutterfly,Especially when the bank is now in full liqudation.,5,stocks
jbsku5q,11o47qi,2023-03-11 11:23:50,nutbutterfly,"""TOM! Pick up the phone!

TOOM! I will fucking lay waste to everything you hold dear and precious. I swear it!

TOOOOOOOOOOOOOOOOOOOOOOOOOOOOM!""",6,stocks
jbslnap,11o47qi,2023-03-11 11:34:44,ProverbialHabits,"That's what HTM assets do, hide unrealized losses from showing up on the balance sheet. That was my whole point.",7,stocks
jbsm1cr,11o47qi,2023-03-11 11:39:47,ProverbialHabits,"That's going to be totally dependent on going interest rates in the market. Faster we approach pivot, the more those will recover value. If higher for longer...well those assets aren't going to recover very quickly.

&amp;nbsp;

Yea, the real losers in all of this are the startups who need this cash for runway. Even if they end up getting all their money back, it might be 6 or 12 months down the line, and they might not survive until then.",2,stocks
jbsm62x,11nnhzg,2023-03-11 11:41:28,ImUrFrand,"""[your money is safe in Bear Stearns](https://www.youtube.com/watch?v=V9EbPxTm5_s)""",1,wallstreetbets
jbsm6kb,11nuooj,2023-03-11 11:41:38,starfirex,Keep that extra month of money in index funds and you will have more money at the end of the year even if you have to pay an overdraft fee,-4,investing
jbsmeu8,11nnhzg,2023-03-11 11:44:40,Haggstrom91,Fucking Inverse Cramer😂😂,1,wallstreetbets
jbsmfjp,11nuooj,2023-03-11 11:44:55,aslander,Yep my company is &gt;3B and used them to some extent,2,investing
jbsmfx8,11nuooj,2023-03-11 11:45:02,jedcorp,Is it true less than 3 percent of deposits were insured by the fdic ?,1,investing
jbsmvgw,11o47qi,2023-03-11 11:50:33,ThunderBobMajerle,"Please just use the word significant instead of non-insignificant. Sorry, just sayin",25,stocks
jbsmx8h,11nuooj,2023-03-11 11:51:10,xiaochenshu,"My company initiated a withdrawal late Thursday evening, after it became clear that the crash was inevitable due to too many VCs advising companies to move the money out during the day. It took several tries to log in. And it was already too late then, it didn’t go through. Then, Friday it was impossible to log in (prior to the shut down). 

Now, SVB portal has always been buggy, but it’s probably fair to say that those who move first, can move fast &amp; easy due to everything happening online. Then, the site gets overloaded as more and more try to do the same. And as the bank catches up, they intentionally slow withdrawals since they know they can’t keep up, until it’s all shut down.

So, from a tech perspective I’d anticipate something similar on the stock market…early birds can do what they want, and then it becomes exponentially difficult as time passes (in the matter of hours).

We are one of the many companies that won’t be able to make payroll on Wednesday. And I would be willing to bet large sums of money on the website + login portal not working on Monday, when everyone will want to get in and wire that $250k out of SVB.",2,investing
jbsmy0z,11o47qi,2023-03-11 11:51:27,Current_Speaker_5684,Best summation of the financial industry.,10,stocks
jbsn3qc,11nxkje,2023-03-11 11:53:28,Ok_Vacation3128,"I never understood this. Campaign donations don’t actually end up in their pockets, right? Like, they can’t pay themselves with it can they?",0,wallstreetbets
jbsn4x1,11o47qi,2023-03-11 11:53:52,Current_Speaker_5684,Guess Ole  Charlee is right about this stuff.,2,stocks
jbsnb2n,11o47qi,2023-03-11 11:55:58,ThunderBobMajerle,Fascinating. Mortgage backed securities causing a banks downfall!? How could we have ever known this was coming!,0,stocks
jbsnqax,11nuooj,2023-03-11 12:01:15,SunnySaigon,"“We don’t use capital letters because that’s what the cool crypto companies do”

“We don’t have your capital, srry”",2,investing
jbsnqgs,11nuooj,2023-03-11 12:01:19,xiaochenshu,"Ask directly. A good leadership team shouldn’t hide this. We called an all-hands yesterday afternoon to inform employees.

A significant portion of tech companies are with SVB due to the very ideal terms they normally extend to startups.
As for payroll companies, Rippling already communicated they have a Chase account they’re going to try to use to move payroll. ADP is supposedly working directly with FDIC to ensure no gaps in payroll. TriNet requires affected clients to direct wire money to a new account, but IMO they are a fool to not say there will be a delay in payroll and to think that is the right solution.

In any case, I’d plan for worst case scenario of at least a delayed payroll in the upcoming weeks.",1,investing
jbsnth9,11o47qi,2023-03-11 12:02:20,Ok_Cap_408,Does anyone know how much Cathie Wood lost on this investment?,2,stocks
jbsntqv,11ny41q,2023-03-11 12:02:26,Individdy,"It's not even fractional reserve anymore. [It's 0%](https://www.federalreserve.gov/monetarypolicy/reservereq.htm):

&gt; Reserve Requirements. As announced on March 15, 2020, the Board reduced reserve requirement ratios to zero percent effective March 26, 2020. This action eliminated reserve requirements for all depository institutions.",3,wallstreetbets
jbsnu9t,11nnhzg,2023-03-11 12:02:38,Euler007,"Love that board. It's the ""we didn't hear no bell"" bear rally poster boys",1,wallstreetbets
jbsnykq,11nuooj,2023-03-11 12:04:08,xiaochenshu,Fwiw the bank runs that happened on Thursday caused the FDIC to step in. The first companies and VCs that panicked accelerated this into the shit down.,1,investing
jbso4at,11nrlmw,2023-03-11 12:06:08,Dr_Emmet_Brown,SVB went under on 15 billion loss. JP has much more than that in unrealized losses so far. Just saying.,0,investing
jbsocea,11nnhzg,2023-03-11 12:08:48,ThatGuy4mInternet,Why is he mumbling i can understand a word,1,wallstreetbets
jbsol79,11nxkje,2023-03-11 12:11:40,moshpitrocker,https://preview.redd.it/d5ks6mae75na1.png?width=1080&amp;format=pjpg&amp;auto=webp&amp;v=enabled&amp;s=520705f09655819e81750685a643c67ec7a81475,4,wallstreetbets
jbsoq0s,11nxkje,2023-03-11 12:13:16,GingerrBearrd,"Legally, no. But they dont follow dems laws cause they make the laws so they above them.",7,wallstreetbets
jbsovbk,11nvd4e,2023-03-11 12:15:05,ImNoAlbertFeinstein,Bernie Madoff !!!,1,wallstreetbets
jbsow5e,11nxkje,2023-03-11 12:15:21,SomeGuyNamedPaul,"Things were fine with English until the Normans invaded in various forms and then all the regular words got replaced with fancier versions of the same thing which were just copies of the French equivalent.  There were already words like meat, but then because of *boeuf* the word beef showed up.  That's what happens when the people running the place effectively speak a different language, their manner of speaking becomes the high-society language and the base words are relegated to being not as fancy.  From a purely numbers standpoint approximately an eighth of the French language was dropped into English.  If it's a rich guy telling a peasant to get that roster they're going to use the word *coq* and soon roosters are also cocks.  Other words like literature had no equivalent for the folks shoveling shit.

So that happened, but English pronunciation still sounded gutteral next to the flowy French language so what we think of as the British accent started to emerge in the 1700s out of English high society who wanted to sound fancier.  One of the first acts of rebellion in the American colonies was to not take up this accent.  It wasn't universally rejected though and certain pockets of the colonies did start to shift, notably Boston due to their being heavily dependent upon trade with England.  This is why to this day the Boston accent is as it is, it's a British accent that got ripped from the womb and then never finished developing.  Listen to it in your head, it's kind of like a malformed cockney.

The takeaway here is that what we know as the British accent didn't exist prior to the 1700s, at all.  What's the best modern representation of the English accent that existed prior to that?  'Murica Fuck Yeah!  Therefore Robin Hood or any period movies should in no way have a British accent but rather an American one.  That royal court portrayed in the viking shows all need to sound like the cast of It's Always Sunny in Philadelphia.  Monty Python And The Holy Grail?  Sorry, even a New Yorker accent is more accurate.  Any kind of Shakespeare play?  Don't even try to speak like Grand Moff Tarkin.",10,wallstreetbets
jbsp0ra,11nuku9,2023-03-11 12:16:52,MobiusCube,"Well, tech startups aren't the backbone of America, so I'm pretty sure we'll be fine.",4,finance
jbspd0h,11o47qi,2023-03-11 12:20:51,TimeTravelingChris,That was my joke. I wasn't arguing with you.,3,stocks
jbspi73,11nqfsm,2023-03-11 12:22:29,EntertainmentIll2135,Ah the old pawn on pawn chess move. You must be what the French call Les Incompetents,1,wallstreetbets
jbspjqy,11nuooj,2023-03-11 12:22:59,that_awkward_chick,Rippling,3,investing
jbsplxu,11nuooj,2023-03-11 12:23:39,bluewave358,Probably right. Real estate there is nuts.,1,investing
jbspr9i,11o0tg3,2023-03-11 12:25:22,Reasonable-Cat-3770,I’m sure Forbes didn’t predict that a bunch of VCs would tell all their clients to pull out $42B in deposits in a single day causing the bank to go under.,3,wallstreetbets
jbsq4sq,11nuooj,2023-03-11 12:29:40,starfirex,It takes a whooooole lot more than one missed mortgage payment for a mortgage to unwind like that. Especially when the person involved is otherwise creditworthy.,1,investing
jbsq554,11nzxhs,2023-03-11 12:29:46,squirea1,I got some bad news for you,2,wallstreetbets
jbsqcdq,11nzxhs,2023-03-11 12:32:04,squirea1,"Yes, when the power goes out I might exchange you a slice or two of my apple for your 5 BTC.  Maybe, I’d have to think about it",1,wallstreetbets
jbsr1oz,11nzxhs,2023-03-11 12:39:54,ScarecrowJohnny,"Maybe it's code for ""shit's about to slide downhill real fast""",1,wallstreetbets
jbsr2ij,11nuku9,2023-03-11 12:40:09,alexopposite,"Not just VC money, crypto money. SVB was one of only three US banks that would look at our crypto trading float accounts. SVB, Signature, and Silvergate. As cash continues to flood out of that sector, there could be more of these. Much of the sector banked overseas too: Bermuda, Malta, Jersey, Cook Islands... served by Butterfield and other niche banks.",2,finance
jbsrip4,11o47qi,2023-03-11 12:45:02,klingma,To be fair unrealized losses DO show up on the balance sheet just not in the asset section. Unrealized gains and losses are recognized via Other Comprehensive Income which is a part of equity section on a balance sheet.,1,stocks
jbsro68,11nxkje,2023-03-11 12:46:41,thicc_ass_ghoul,*skeptical Fry face*,1,wallstreetbets
jbsrwxh,11nxkje,2023-03-11 12:49:19,McSnoots,Didn’t beary say something about this being a white collar recession,3,wallstreetbets
jbssmyp,11nnhzg,2023-03-11 12:56:56,WhyAmISoSad369,"Hilariously enough, I've never actually watched a video of him. I just keep seeing ""INVERSE CRAMER"" comments, 5 seconds into this video I said out loud even ""wow what an annoying prick"". Just has one of those...everythings",1,wallstreetbets
jbsstvv,11nuooj,2023-03-11 12:58:56,dollarsandcents101,"LCR assumes 30 days of cash outflows. This happened much quicker - which makes sense. I could see tweaks in LCR requirements being studied dependent on FDIC coverage (as the more a customer's deposit is uninsured, the more they are likely to pull it all if a bank run starts, the shorter the time window should be).",1,investing
jbst5di,11nnhzg,2023-03-11 13:02:11,MtnMaiden,Tardigraded,1,wallstreetbets
jbstb9p,11ny41q,2023-03-11 13:03:50,Gunners414,"""what the hell are you doing with MY money in your house Fred?"" Is going to be quoted a lot by my this week",1,wallstreetbets
jbstbpe,11nuku9,2023-03-11 13:03:57,Guns_and_glory99,How do we know other banks didn’t also make this type of stupid move….we don’t.,3,finance
jbstlsk,11nvd4e,2023-03-11 13:06:46,WSSquab,Juegardo,1,wallstreetbets
jbsto13,11nuooj,2023-03-11 13:07:23,rand0m_task,A shit ton of the funds were uninsured. I think Roku had like 500 mil and Roblox 150 mil..,1,investing
jbstptb,11nqfsm,2023-03-11 13:07:52,AmplitudeTrader,"True, then should have sold naked calls.",1,wallstreetbets
jbstqkb,11nxkje,2023-03-11 13:08:04,djit,You better check yo' self before you wreck yo' self,1,wallstreetbets
jbstw84,11nuku9,2023-03-11 13:09:36,wolfbetter,2008 here we goooo,2,finance
jbstwzm,11nxkje,2023-03-11 13:09:48,blackhappy13,This is going to have a huge knock on affect,1,wallstreetbets
jbsty2p,11o47qi,2023-03-11 13:10:06,Smipims,The FDIC allowing anything less than 100% of value will shake total confidence in the market.,3,stocks
jbsu27r,11nzxhs,2023-03-11 13:11:14,thicc_ass_ghoul,![img](emote|t5_2th52|27189),1,wallstreetbets
jbsudzf,11nxkje,2023-03-11 13:14:29,nokiddinhuh,so you mean someone knew it would go under today and sold a bought a ton of puts?,1,wallstreetbets
jbsug3b,11o0tg3,2023-03-11 13:15:04,Outrageous-Onion1991,"I think he has a 30-40% correct which is probably around average, for the average person taking a crack at stocks. I think he just able to keep views on his show so they've kept him. I think he does an okay job, I get his ""Cramer report"" email. But I don't think I've actually followed any of his recommendations",1,wallstreetbets
jbsupnt,11nvd4e,2023-03-11 13:17:36,normalgymrat,![img](emote|t5_2th52|4263),1,wallstreetbets
jbsutox,11nue1b,2023-03-11 13:18:41,weedmylips1,And one of trump's biggest donors,1,stocks
jbsuvj7,11o0tg3,2023-03-11 13:19:10,butter_chicken69,Forbes is an Ad agency. My friend got offered to pay to be in 30 under 30.,3,wallstreetbets
jbsuw03,11nue1b,2023-03-11 13:19:17,davewritescode,"You’re completely clueless.

California has its problems but it’s economy isn’t one of them.   It has the most diverse economy of any state in the US and it’s really not even close. 

1.	Tech 
2.	finance (VC)
3.	agriculture
4.	tourism
4.	Hollywood/Entertainment
5.	energy (California produces 2.5 million barrels of oil/day)

It’s a political meme that “lol California is a failed state” but it doesn’t hold up to even minor scrutiny

Also, I’m not from nor do I live in California.",1,stocks
jbsv41m,11nuku9,2023-03-11 13:21:25,Parabola_Cunt,"SVB is “the” VC go-to bank for CA startups. You might not know them, but anyone in CA tech knows them and likely has worked with them. My company credit card was issued through SVB at my last company for example. They were involved with crypto BS, but they also had other speculative tech clients too. Lots more, in fact.",3,finance
jbsv7pc,11nuooj,2023-03-11 13:22:22,bens111,0% fractional reserve lending is a literal scam,2,investing
jbsv9ha,11nue1b,2023-03-11 13:22:52,farhad1371,What we gonna short this Monday?,2,stocks
jbsv9p7,11nue1b,2023-03-11 13:22:55,Acesonnall,"Top 5 companies impacted by asset percentage:

Roku: $487 million in cash, which is about 25% of its total assets as of December 31, 2022

Rocket Lab: $70 million in cash, which is about 20% of its total assets as of September 30, 2022

Roblox: $50 million in cash, which is about 5% of its total assets as of December 31, 2022

Sangamo Therapeutics: $34.4 million in deposits, which is about 12% of its total assets as of December 31, 2022

Repare Therapeutics: less than 2% of its marketable securities, which is about 1% of its total assets as of September 30, 2022",1,stocks
jbsvghz,11nuooj,2023-03-11 13:24:41,PG67AW,"&gt;One of the top 20 banks that a lot of VC's and startups used.

The Vietcong are still around? Huh, who knew?",-1,investing
jbsvgsa,11nxkje,2023-03-11 13:24:45,L0nkFromPA,"So I read the Wikipedia page on check kiting ( https://en.wikipedia.org/wiki/Check_kiting ) and simply writing yourself a check for money that is in your account is definitely not illegal or check kiting.

It would only be illegal if you’re taking advantage of delays to make it so you can use more money than you actually have.

Edit: I am not a lawyer and this is not legal advice.",23,wallstreetbets
jbsvjwn,11nuooj,2023-03-11 13:25:33,Interesting-Fuel238,"You say ""decided"" to sell like they had a choice. My understanding is they ""had"" to sell to provide sufficient capital as there was already a run on the bank because the tech industry is struggling and they needed to make payroll.",1,investing
jbsvmm2,11nuooj,2023-03-11 13:26:16,AltOnMain,"It’s not a ponzi scheme, but the bank probably mismanaged their assets. Most of SVB customers were tech companies or tech adjacent. Tech companies haven’t been doing as good so they have less revenue coming in (to SVB) and are pulling more of their reserves for operating capital (from SVB). 

This caused a greater demand for cash than SVB anticipated so they needed to sell some of their near cash assets. The problem is, a lot of their near cash assets are held as bonds and certain bonds have taken a beating. For example they have a lot of treasury bonds that yield 2%. Well, you can go out today and buy a treasury bond that yields 4.5% so who wants to pay face value for the 2% bond? 

Anyways, this means that they have less cash on hand than they thought and they are way less liquid than they thought. They probably got a big capital call or two earlier this week and the bank was like “uhhhhh, we will get back to you about that” and the customer was probably like “what do you mean, you are a bank, give me my fucking money”. From there, it’s sort of a small circle they bank with and they get a big run and enter a death spiral.",1,investing
jbsvt1o,11o47qi,2023-03-11 13:27:59,Inconceivable76,"What?

How would companies pay bills?",3,stocks
jbsvt5s,11nuooj,2023-03-11 13:28:01,SerenaSurf1,Well that was quick,2,investing
jbsvv7t,11nue1b,2023-03-11 13:28:33,gitbse,"Socialize the losses, privatize the gains",2,stocks
jbsw0i0,11nue1b,2023-03-11 13:29:57,ancillarycheese,"I bet there will be some delayed payroll, even the ones that got out early will need to reposition their payroll vendor with new banking.",1,stocks
jbsw1l1,11nue1b,2023-03-11 13:30:13,Akira282,97 per cent of deposits are uninsured,1,stocks
jbsw4rm,11nvd4e,2023-03-11 13:31:02,CopperMurphy,Because any of us know how to do that,15,wallstreetbets
jbswadw,11nue1b,2023-03-11 13:32:32,ancillarycheese,"The big issue here are businesses who were using SVB well in excess of FDIC limits, and the individual employees who are counting on their employer to make payroll.

It sounds like ultimately whoever takes over SVB is going to be able to cover most/all deposits but it may take time to liquidate positions in a way that does not result in a loss.",1,stocks
jbswbpu,11o47qi,2023-03-11 13:32:54,DizGod,Yea this is the opposite of my definition of “fine”.,2,stocks
jbswf6h,11nqfsm,2023-03-11 13:33:49,No-Understanding9064,This is how jpow is gonna get those unemployment numbers up,3,wallstreetbets
jbswh5m,11nue1b,2023-03-11 13:34:20,gitbse,"&gt;Let it fail. Banks need to be allowed to fail if there is no risk to the overall economy.

Executives need to be thrown in prison when this happens. How often will this continue to happen? Will we get down to a 5 year collapse cycle?",4,stocks
jbswjuq,11nxkje,2023-03-11 13:35:03,kopfgeldjagar,"If you had 10m to put in the bank, wouldn't you have an accountant to do that shit for you?",1,wallstreetbets
jbswxwz,11nue1b,2023-03-11 13:38:39,mistergoodfellow78,Rated A3 by Moodys until a few days ago..,3,stocks
jbsx2hz,11nuku9,2023-03-11 13:39:50,DrStrangePlan,"Never forget when times get tough, there's always money in the banana stand.",3,finance
jbsx9mv,11nvd4e,2023-03-11 13:41:38,Own_Cartoonist266,Sounds like the right kind of bank to go out of business.,3,wallstreetbets
jbsx9xq,11o0tg3,2023-03-11 13:41:43,HeadSpade,It’s always has been this way. Nowadays just more light is being shined on it,1,wallstreetbets
jbsxfxl,11o0tg3,2023-03-11 13:43:15,HeadSpade,That’s exactly what it is. I hope more and more people will come to realize that,1,wallstreetbets
jbsxlug,11o47qi,2023-03-11 13:44:46,BilbodeBaggins,"Counterpoints. They are growing active accounts, streaming hours and are top streaming platform in North America by a good margin. Very little market share outside North America. Streaming market is still growing overall and likely to continue.

Their revenue / margins have been crushed by reduced ad revenue which is where they make money, not hardware. However, their stock price has already been absolutely crushed (though recovered a bit… 47% YTD).

They may not make it, but not so sure it’s a terrible high risk / reward buy if it dips back to 30s. If  or when the  market and economy eventually turns around and ad spending returns, this could make a huge run in next bull market. 

Also possible you are correct and Google etc. take their market share, but to say it’s already fading away is not true IMHO.",15,stocks
jbsxmkp,11nue1b,2023-03-11 13:44:57,BBags15,"Only about 3% of their deposits are fall under the FDIC limit. This is a nightmare for over 60,000 startups.",1,stocks
jbsxzk0,11nxkje,2023-03-11 13:48:15,d-redze,"Protecting your value is your responsibility. Want to or not,  if you don’t protect your valuables then you better be ok with someone else taking them from you. 
And yes. Your net worth would be safer in BTC then a bank. That is the entire point.  Right now in it’s early phase. People see the volatility and get scared. Valid concerns if your not in a position to stomach that or wait it out.  But once btc has stabilized in the future and is no longer a “speculative play” people will realize what it really is. It is infinitely safer then a bank.",1,wallstreetbets
jbsxzro,11nue1b,2023-03-11 13:48:18,BBags15,SVB is (was) like the 18th largest financial institution in the states and handles half of the VC/Start-ups in the country. It WAS a reputable bank. Pretending it wasn’t is so comically inaccurate.,4,stocks
jbsy246,11nue1b,2023-03-11 13:48:54,us1838015,Building &amp; loans are community owned.,2,stocks
jbsy63i,11o0tg3,2023-03-11 13:49:54,arun111b,I want to know other names in the list,2,wallstreetbets
jbsy6ho,11nm65s,2023-03-11 13:50:00,LiveLearnCoach,ELI5?,1,wallstreetbets
jbsyo83,11nuooj,2023-03-11 13:54:24,echosixwhiskey,"Damn, they had a good “Truuuuust us👍” thing going on again for a little while. What’s the US dollar backed up by? “Truuuuuust us👍👍👍”. Because it’s certainly not gold in total. Things created out of thin air don’t hold any weight. It’s Matthew McConaughey’s character in WOWS when he’s talking about this is all a fugazi and transferring money (again, out of thin air, trust us) from the rube to the broker. I’m not surprised. Hey I saw your edit, but have you heard about income generation, loan structures, and fractional reserve banking? You had it right. Don’t let the fools take you down. It is a Ponzi scheme which is what fractional reserve banking is. Have a good one",0,investing
jbsyqc3,11nue1b,2023-03-11 13:54:53,DamianFitness37,oooof,1,stocks
jbsyugp,11nuku9,2023-03-11 13:55:54,Khayembii,"It’s 2-3% because most of their clients were businesses. Honestly that’s how most banks work. The vast majority of any bank’s deposits will be corporate, because businesses have more money than individuals.",1,finance
