id,post_id,timestamp,author,text,score,subreddit
jbu8hjh,11nxkje,2023-03-11 19:25:41,d-redze,"People suck at their jobs sometimes. At least with BTC (not crypto as a whole) if you lose your money it’s 100% your fault and you know why it happened. Granted it does take personal responsibility to secure your funds with btc, but I don’t think that fact in itself makes it less safe. I’d much rather trust myself then a group of people I don’t know who work for a business. A business that’s 1st priority it to make money. Protecting their customers my be high on the priority list for reputable banks, but it’s not the first priority. This is not the first time a bank run has happened and it won’t be the last. Also depending on where you live it might even take a bank. It was truly despicable what happened in china last year where people lost their entire accounts. I think the clients at SVB will get their funds, this time. But taking that for granted is a mistake and it is not a guarantee.",1,wallstreetbets
jbu8ok7,11o4plm,2023-03-11 19:27:04,DrNukes,"ONE
HUNDRED
PERCENT
YES",1,technology
jbu8ony,11nx7eq,2023-03-11 19:27:06,jonnyCFP,"Roku rolls into SVB - yes I’d like to open up 2000 accounts for $250,000 each.",1,investing
jbu8wti,11nuooj,2023-03-11 19:28:44,gernald,"Yeah. but buying the assets at a discount would be a problem in trying to make account holders hole. Who cares if the Feds force another bond sale prematurely if that will only cover 50% of account holders funds?

Any property holdings they have will take time to sell, unless as you pointed out it's all done at a steep discount.

The question is will any discounted sale cover the remaining balances owed to account holders?",1,investing
jbu9czo,11nvd4e,2023-03-11 19:31:56,ComedyGrappler,Might have to watch that this weekend.,1,wallstreetbets
jbu9gqu,11nvnq1,2023-03-11 19:32:41,BuySellHoldFinance,Raise rates. Let the banks go under.,1,wallstreetbets
jbu9tce,11o47qi,2023-03-11 19:35:13,jthompson473,And here comes the American tax payer to bail yet another bank out......,1,stocks
jbuadly,11nx7eq,2023-03-11 19:39:14,piglizard,Too late- should’ve been shorting the banks to make money.,2,investing
jbuajt9,11nzsfc,2023-03-11 19:40:30,benskieast,"Many were forced by VCs to use SVB exclusively. In addition bank failures are incredibly rare. And many of these risks are manageable, you may just need to pay some late fees but employees may struggle with late payments. Being a one off clearly outside the business control many late fees should be avoided.",0,wallstreetbets
jbuam1q,11nzsfc,2023-03-11 19:40:58,Peteostro,Yeah sucks being/working for startup some times,1,wallstreetbets
jbuam3h,11o4plm,2023-03-11 19:40:58,IdesOfMarchCometh,"Keep in mind it's mostly concentrated in one area, tech, and the bay area, for now. So if you're in tech, the ongoing layoffs will get worse and already it's pretty bad with many unable to find jobs and salaries are down. Real estate in general takes awhile to react and it's already reacting.  Bay area and Seattle housing are  tanking and people are looking into foreclosing after not finding a job. Foreclosing on $2m+ properties which might be a good chunk of the big banks given that they gave out these mortgages to faang employees and ""stable"" startups, all of them are now laying off regularly, with meta next week, Google in 2 weeks per rumors. The rumors were right in the past. If the startup employees relying on SVB start losing their jobs because cash isn't there then things accelerate and expand as those laid off employees with a mortgage can't find jobs. People who think this won't spread are not seeing the big picture. There's a lot of money and big bets in tech that could easily blow up.",2,technology
jbuawzq,11nx7eq,2023-03-11 19:43:11,dontyouknow88,People seem to really not understand how FDIC insured amounts work. Or who SVBs clients are and why they would have more than $250k in a bank account. Business clients are unlike personal customers in some materially different ways.,12,investing
jbub9xq,11o4plm,2023-03-11 19:45:47,IdesOfMarchCometh,Exactly. If they don't step in now and stop it then this most likely will blow up beyond tech.,1,technology
jbubaxs,11nx7eq,2023-03-11 19:46:00,Special-End1491,"But if banks goes down, sp500 dwj etc goes down too no?",1,investing
jbubd67,11nzsfc,2023-03-11 19:46:27,Psychological-Poet-4,"250k per depositor, so joint accounts can get 500k.

But in investment capitalist crowd is screwed",2,wallstreetbets
jbubi19,11o47qi,2023-03-11 19:47:26,saudiaramcoshill,"&gt;Would you agree, though, that Roku (or any company) with $450 million in uninsured accounts at one bank is unusual? 

Sure, yeah, unless you're the size of Google or Apple and holding $100B+ in cash equivalents - I'd imagine that your counterparty risk appetite increases there a bit simply because you start to have limited places to keep your cash.

&gt;CDARS 

Companies (at least that I've been a part of) don't use this for various reasons, the main one being relationships with your bank. Our relationship banks would be pissed if we were splitting deposits like that and we would end up with higher costs for banking services in general as a result.

&gt;cash management account

Same concept as above. I don't know of any large company that's used either a CMA or CDARS product.",2,stocks
jbublau,11o4plm,2023-03-11 19:48:07,jakkakt,Holy fuck  I’d go on a rampage if I didn’t get paid,1,technology
jbubr7o,11o4plm,2023-03-11 19:49:20,Rajvagli,"Just watched The Big Short last night, shit is crazy out there.",1,technology
jbubu7e,11nw54y,2023-03-11 19:49:56,Cuppieecakes,they should have invested in mattresses,1,wallstreetbets
jbubxfu,11nzsfc,2023-03-11 19:50:35,DrSouce12,"&gt; guaranteed to not bounce

Unless the bank fails and has their assets seized by FDIC.  Point is, if your bank is in the process of failing, cashiers check is kinda worthless",2,wallstreetbets
jbuc896,11nzsfc,2023-03-11 19:52:45,HeisenBo,Asking to be robbed,1,wallstreetbets
jbucazv,11nue1b,2023-03-11 19:53:18,kosmoskolio,SVIB trouble has been all around crypto twitter for some time now.,1,stocks
jbucgdv,11o49kk,2023-03-11 19:54:23,oshinbruce,"Im sure we will need more time to find the details but considering its an industry to venture fund small tech companies that don't turn a profit for 10 years, I'm wondering if we will see a big knock on impact. The interest rate hikes have understandly killed this type of lending",1,news
jbucijq,11nw54y,2023-03-11 19:54:50,kkirchhoff,How would they know months in advance that people were going to withdraw more money than they had in several days?,1,wallstreetbets
jbuclik,11o49kk,2023-03-11 19:55:25,Rampage_Rick,"Patriot, Rippling, and Wrapbook are three payroll processors that I've seen mentioned as being affected.",3,news
jbucns5,11o49kk,2023-03-11 19:55:52,WallStCRE,"You can diversify your cash holdings at a minimum into a few banks, like Roku",1,news
jbucrcu,11nue1b,2023-03-11 19:56:36,MdotTdot,"I agree with it's unique to this bank that takes money from VCs who have cash burning businesses.

They were forced to buy these bonds at top price during all that QE and now they got hit with the fastest hiking ever. Does that mean it's their fault? Absolutely not, they would've been fine if it just wasn't the fact that the VCs were burning cash in this environment and needed more and had no choice but to withdraw.

I don't think SIVB is the contagion effect either, but it's just showing what could happen to something else that might be the effect.",2,stocks
jbucs2x,11nx7eq,2023-03-11 19:56:44,piglizard,Not necessarily,2,investing
jbucx65,11nx7eq,2023-03-11 19:57:45,Kiyae1,"Yes I’m familiar with how the FDIC works. 

Member dues are an expense that gets passed along to customers, so basically anyone participating in the banking system is paying for the FDIC. It’s really not different than if it was paid for by income taxes out of the general fund.",1,investing
jbud1gj,11o43hh,2023-03-11 19:58:36,Consistent_Dig2472,Not what happened.,1,technology
jbud1pl,11nx7eq,2023-03-11 19:58:40,Special-End1491,"Ok, thanks for your opinion 😊✌️",1,investing
jbud46r,11nw54y,2023-03-11 19:59:11,screwswithshrews,Does this only apply to cash accounts or would 401ks / IRAs apply as well? That's probably the only time I would need to worry about having &gt;$250k with one institution,3,wallstreetbets
jbud8pw,11o47qi,2023-03-11 20:00:06,SuperNewk,Schwab to the rescue!,1,stocks
jbud9ji,11nx7eq,2023-03-11 20:00:16,_ShadowWalker_,"Woah is this an American thing? 

I’ve never heard of mortgages being sold to another company here in Canada",1,investing
jbudja5,11o43hh,2023-03-11 20:02:13,Consistent_Dig2472,Wow. Well ducking said.,2,technology
jbudk7j,11nuku9,2023-03-11 20:02:25,appsecSme,"All of business has risk and all business segments have ""fabled diamonds"" who ended up leaders, and plenty of others that failed.

Also, this has absolutely nothing to do with the startups doing anything risky or wrong. It was all about the bank getting overexposed in treasuries that lost value, and then an ensuing bank run.

Finally, SVB explicitly doesn't invest in cryptocurrencies and even anything web3 related, so again that has very little if anything to do with this.",1,finance
jbudm53,11o4plm,2023-03-11 20:02:49,TheNotSoGreatPumpkin,"Scroll down and there should be a skip button, assuming it’s the legit Roku site.",1,technology
jbudopy,11o47qi,2023-03-11 20:03:20,SuperNewk,"I am trying to call my local bank to see if they will bid.  Phones are busy so I am assuming the interest is off the charts.  Bidding war for their cash, could actually end up more than its worth !",1,stocks
jbudybv,11nxkje,2023-03-11 20:05:18,Silbb,So I’ve seen many instances of people not knowing how their private key was leaked so I don’t agree that people always know why they lost their btc. It doesn’t take some responsibility to secure you wealth with btc if you have a high net worth it takes an enormous responsibility because there are no reverse transactions. Go take a security course the number one rule is everything will get hacked eventually so you need to design your system in a fault tolerant way that can recover. Crypto does not have a way to recover because there is no such thing as fraud from the blockchains perspective. If you got the private key you are the owner even if it’s not legitimate. Curious would you say you have a high net worth in crypto?,1,wallstreetbets
jbue8cw,11o49kk,2023-03-11 20:07:19,GunBrothersGaming,Basically - I think you would have had a better shot at getting your money back if it was stacked on a Norfolk Southern Railway car in Ohio.,2,news
jbue8l9,11nue1b,2023-03-11 20:07:21,nukem996,"Yes, most banks are supposed to manage risk well enough that this doesn't happen. The fed does want this to a certain extent. They're trying to slow down the economy and nothing does that like banks failing.",1,stocks
jbuefa0,11nzsfc,2023-03-11 20:08:40,Weird-Conflict-3066,"Need to staup by Dunkin grab a crawler an a extra large, have three parliaments take a dump and I'll be there.",1,wallstreetbets
jbueizy,11o47qi,2023-03-11 20:09:27,AdMaleficent2789,Puts on Monday?,1,stocks
jbuesf7,11nvd4e,2023-03-11 20:11:20,These_Drama4494,DONT YOU DARE PUT THOSE FUCKERS IN THE SAME LEAGUE AS OUR LORD AND SAVIOR HARAMBE,1,wallstreetbets
jbuet23,11nw54y,2023-03-11 20:11:27,mrpoopistan,"If nothing else, it'll be interesting to see how the government approaches the problem. It seems ridiculous to make account holder whole on uninsured accounts when they weren't hedging against interest rate hikes.",1,wallstreetbets
jbuf2cd,11nzsfc,2023-03-11 20:13:18,bigthangs1,Big guys employ the small guys. If my boss had all his money in there and don't got none for my payroll then I'd care,1,wallstreetbets
jbuf3qw,11o49kk,2023-03-11 20:13:36,IlIFreneticIlI,Agreed.  At least we know that train (money) aint going anywhere!,1,news
jbuf75k,11o47qi,2023-03-11 20:14:16,berten0808,I dont understand why you americans need a middle man!,2,stocks
jbufdsf,11o47qi,2023-03-11 20:15:36,Tlaloc_5247,Just like the Titanic was mostly fine?,1,stocks
jbuff0d,11o4plm,2023-03-11 20:15:51,TheNotSoGreatPumpkin,"All they can see is what you watch while using their device, which ads interest you, and if you buy things through them. Everyone does that.

It’s not like they’re reading our emails, looking at our personal photos and videos, tracking our browsing habits, and keeping tabs on who we associate with like certain larger companies do.",1,technology
jbufgnq,11nuku9,2023-03-11 20:16:11,nysrpatakemyenergy2,&gt; [They didn't have a Chief Risk Officer for basically the last 12 months.](https://youtu.be/Elyfo1DIlzs?t=32),1,finance
jbufm1h,11o4plm,2023-03-11 20:17:18,Kruse,This is the second largest bank collapse behind Washington Mutual. You bet your ass it's a big part of the economy.,1,technology
jbufrje,11o49kk,2023-03-11 20:18:23,hexagonalshit,Approved. I'd definitely put my money there,3,news
jbufx4x,11nzsfc,2023-03-11 20:19:29,EsotericVerbosity,"Guaranteed*

&gt;by the issuing institution",0,wallstreetbets
jbufz4w,11o47qi,2023-03-11 20:19:53,Tlaloc_5247,Then the local real estate values drop as more homes come to market,3,stocks
jbug6wu,11o47qi,2023-03-11 20:21:26,malone66,"is it just me, or does this whole forum not understand the difference between cash and cash equivalents?",0,stocks
jbugdfo,11o47qi,2023-03-11 20:22:43,saudiaramcoshill,"I was talking about both in my comment. We held much more than $250 k in actual cash, too. You seem to only be reading what you want to read, or not understanding what is actually written.",3,stocks
jbuge7a,11o4plm,2023-03-11 20:22:52,damola93,"No one is doing this. The bank has failed, and the depositors will be made whole from the assets of the bank. Only deposits of 250K and below are guaranteed by the government, and that is at any bank in the US. These guarantees only kick in if the bank's assets can not meet the insured deposits, which is not likely in this case. I have seen figures ranging from 85-97% of the deposits being uninsured. 

The uninsured depositors are not going to be bailed out, the FDIC is stepping in to make sure the sale of the banks assets goes as smoothly as possible. The company is in receivership, and the FDIC is sorting out who gets what as the sale goes on.",1,technology
jbugh1j,11nx7eq,2023-03-11 20:23:25,T8ert0t,"Betterment had similar language, but their TOS was REALLY open ended where it was phrased that it offered 25 million in insurance, but only to the extent deposits were equally distributed among the participating deposit banks, and you (as depositor) had no control or insight as to where your funds would be held. 

How clear is the WF language?",3,investing
jbugkl0,11nzsfc,2023-03-11 20:24:07,juffury3,"Most of these tech start ups were never profitable to begin with. Nobody batted an eye when interest rates were 0%, but now people are waking up.",0,wallstreetbets
jbuglrt,11o49kk,2023-03-11 20:24:22,ABenevolentDespot,SUPERB comment! Hilarious. Well done!.,1,news
jbuglyh,11nx7eq,2023-03-11 20:24:24,Murghchanay,The FED is the lender of last resort and would give the banks loans until the bank run would be over.,1,investing
jbugmrz,11o4plm,2023-03-11 20:24:34,BaneThoth766,I love my Roku tv,2,technology
jbugnh4,11o43hh,2023-03-11 20:24:42,JohrDinh,"As evidenced by the fact that when one does something that works, I get the same damn feature on every other app. Idk why I have 5+ apps that do all the same stuff on my phone, and just using one is a monopoly...better to just have none of them.",2,technology
jbugof1,11nzsfc,2023-03-11 20:24:53,BandwagonReaganfan,That Porsche ain’t getting repo’d. Wellesley is as old money as it gets in the US. They will be fine.,2,wallstreetbets
jbugto7,11o49kk,2023-03-11 20:25:55,DooooYouuuRealize,"Roku says 26% of its cash reserves are gone from Silicon Valley Bank.

There I fixed the headline for you.",1,news
jbugvng,11nzsfc,2023-03-11 20:26:19,donrather,"G'ol fashioned Bank run, aye",2,wallstreetbets
jbuh48w,11nw54y,2023-03-11 20:28:05,Beneficial_Course,Now imagine if you didn’t have to deposit your money to someone who lend it out 10 times and lose it?,1,wallstreetbets
jbuh8dp,11o49kk,2023-03-11 20:28:57,NetworkLlama,"Banks are under extraordinarily strict regulations compared to most other industries (even with the rollbacks under Trump) and the Fed watches and tests them regularly. One can argue that they deserve more regulation and scrutiny, and one might be right, but the lessons learned after the Great Depression almost a century ago were not lost.

For all the chaos after the Great Recession, the Fed handled the wind-down of 465 financial institutions from 2008-2012 and implemented additional stability tests (which themselves took down some of those 465). Whatever one thinks of those running the banks, the system itself did not fail, and that's very important.",2,news
jbuhopq,11nuku9,2023-03-11 20:32:17,daddytorgo,Yuuuuup. Pretty much!,1,finance
jbui5j6,11o0tg3,2023-03-11 20:35:43,YodelingTortoise,"Actually, you're half right. You should compare it to I bond performance. Then you're measuring success adjusted for inflation.",1,wallstreetbets
jbuid2p,11nue1b,2023-03-11 20:37:15,honeycall,"I thought for bonds that have negative convexity, prices decrease as interest rates fall.

So when prices increase when interest rates rise, no?",1,stocks
jbuin70,11nue1b,2023-03-11 20:39:17,likediscosuperflyy,I’m 5 years from now? Or asap? 😂,1,stocks
jbuipwg,11o43hh,2023-03-11 20:39:49,RepresentativeMeat47,It’s almost like loyalty doesn’t exist anymore… says the guy who was just laid off from a massive tech company after 15 years with no warning and crap severance.,1,technology
jbuitm3,11nx7eq,2023-03-11 20:40:34,GMOrgasm,https://finance.yahoo.com/news/giannis-antetokounmpo-put-money-50-143319084.html,3,investing
jbuityk,11o43hh,2023-03-11 20:40:38,RepresentativeMeat47,"Investors don’t exist anymore, only stock speculators.",1,technology
jbuiws5,11o43hh,2023-03-11 20:41:12,RepresentativeMeat47,And one of your kidneys,3,technology
jbuixp7,11o43hh,2023-03-11 20:41:23,AtomicTardigrade,"How can banks even go bankrupt when their business is literally bullet proof? The profits I get from my savings are pathetic, but the moment I want to take a loan, they'll slap insane rates on it. How can such shit go under lol? I mean, I know how, they hand out uncovered loans and do weird ""we're gonna make quick money with crypto"" shit, but still...",0,technology
jbuj4xb,11o4plm,2023-03-11 20:42:52,w2qw,You are talking about if they are insolvent rather than technical issues with payroll or cashflow issues. Roku likely has the money to cover this or can raise more. They seem to have a $8bn market capitalisation. That could change though in which case they would cease operations.,3,technology
jbuj7mj,11o43hh,2023-03-11 20:43:25,RepresentativeMeat47,This is all part of the Federal Reserve’s plan. The want to sacrifice 2M American jobs to lower interest rates and for “the good of the economy.”   AKA. Our stock’s performance is better when people will work for less $$ because they are starving to just have A job,2,technology
jbujeb2,11o49kk,2023-03-11 20:44:45,BusSeatFabric,"Rippling is the one I see potentially impacted the most.

They are the biggest of the 3 and are heavily dependent on the Y combinator community so lots of their clients will have funds tied up with SVB.

Payroll companies easily move over $1B through banks on an average Friday so if they have to wait on those funds for a few weeks it might be a shitty time.",1,news
jbuk0bf,11nuooj,2023-03-11 20:49:12,iso20022_,funnier that i got downvoted afterwards ahahaha,1,investing
jbuldtk,11o4plm,2023-03-11 20:59:09,Hot_Bass_3883,Genius level accounting,1,technology
jbulnao,11nx7eq,2023-03-11 21:01:05,RainandPixels,Is the fdic 250k taxed?,1,investing
jbulpxv,11nw54y,2023-03-11 21:01:38,iamdjm,Lol.. yeah.. lesson learned!,2,wallstreetbets
jbulyfh,11nue1b,2023-03-11 21:03:22,timshel_life,Still around in the heart,2,stocks
jbum13z,11o49kk,2023-03-11 21:03:55,photofluid,A significant portion of that 212b is unrealized losses.,1,news
jbumbm5,11nw54y,2023-03-11 21:06:05,EdDantes007,"Not SVB, the pensions invest in the VC funds that fund the startups.",1,wallstreetbets
jbumd0v,11nw54y,2023-03-11 21:06:22,Maditen,"Retirement accounts are not usually insured, here is a list of the type of accounts that are not insured: https://www.fdic.gov/resources/deposit-insurance/financial-products-not-insured/

If the funds are in money markets, checking or savings as liquid funds would be, those are insured.",2,wallstreetbets
jbumgga,11nx7eq,2023-03-11 21:07:03,Jmbh1983,"That’s a question for your tax accountant.
I don’t believe so (since you’re not making a gain, per-se), but rather you’re actually more likely to get a write-off on amounts _above_ $250k.",1,investing
jbumn9d,11nx7eq,2023-03-11 21:08:26,Jmbh1983,"That’s a question for your tax accountant.
I don’t believe so (since you’re not making a gain, per-se), but rather you’re actually more likely to get a write-off on amounts _above_ $250k where you don’t get full recovery - e.g. if you had $350k, and got back 80c on the dollar above $250k (so you get back $330k, and lose $20k), then I’d expect you could write off the $20k loss.",1,investing
jbumvct,11nqfsm,2023-03-11 21:10:05,BarebowRob,YOLO puts for $$$$.,2,wallstreetbets
jbumvpa,11nx7eq,2023-03-11 21:10:09,zxc123zxc123,"Just want to say that the ""big 4"" banks ***SHOULD^1*** be fine since they got bailouts last time during the GFC and the government subsequently placed heavy restrictions on them (which have been relaxed a bit during the Trump years but not even close to the lax rules pre-GFC). Those new laws &amp; regulations, added restrictions on what types of businesses they can engage in, and likely annual stress tests should keep the biggest banks free from this contagion and able to withstand a SVB style bank run EVEN IF regular folk tried it.


^(1 assuming no illegal play)",4,investing
jbunfop,11nzsfc,2023-03-11 21:14:16,what_comes_after_q,It would be fitting and not surprising if it was just a thin veneer of stone on top of normal plywood,2,wallstreetbets
jbuo0vw,11o49kk,2023-03-11 21:18:41,WhySheHateMe,FDIC only insures up to 250k,2,news
jbuodvy,11nzsfc,2023-03-11 21:21:23,Reasonable-Cat-3770,No that’s incorrect. You need to brush up on your ABA reading.,2,wallstreetbets
jbuoioi,11nx7eq,2023-03-11 21:22:22,gravescd,"It's not a negative on your personal balance sheet. If you're just a deposit customer, you're not paying for anything, so it can only materialize as getting a minuscule amount less in interest on your checking or cash savings account. 

Framing as a bailout is completely misleading. The bank bailouts were government purchases of toxic assets to prevent banks from failing in the first place.",1,investing
jbuokr8,11nx7eq,2023-03-11 21:22:49,OCojt,No taxpayer bailouts!,0,investing
jbuotla,11nx7eq,2023-03-11 21:24:37,notjakers,"Someone calculated a floor of about 80% of funds recovered, which could drop to 70% since a lot has been pulled. 

I’ll stick with my 90% estimate. Time will tell. 
https://mobile.twitter.com/jb_twe_ets/status/1634567355295576066",1,investing
jbuozsn,11o4plm,2023-03-11 21:25:54,BoDrax,"We all too often have socialism for the rich and rugged free market capitalism for the poor.

MLK Jr",3,technology
jbup356,11o49kk,2023-03-11 21:26:36,not918,"Are you a time traveler? I wish you'd tell me where to put my money instead of telling me about a crash that will happen in 2088...Haha

&amp;#x200B;

But really I know you meant 2008, and I think your evaluation is spot on.",2,news
jbup64y,11nue1b,2023-03-11 21:27:14,Artistorgambler,What about stock holders? Will they get q rescue?,1,stocks
jbupgui,11o43hh,2023-03-11 21:29:26,Lost_Equipment_9990,"Trouble Asset Relief Program. You know, if you mess up and say flush a billion of your ""customers"" money down the toilet you get to walk away with no consequences. Unless of course you were stupid enough to make bad business decisions in a low class industry like manufacturing or building. In that case you're out of luck. But if you got an MBA and an expensive suit you get a nice trampoline called TARP to land on.",1,technology
jbuppva,11o4plm,2023-03-11 21:31:19,geekynerdynerd,"Sorry, I meant to respond to a different comment chain. The one I had meant to respond to said bailouts are fine so long as the government charges interest.",1,technology
jbupu4j,11o43hh,2023-03-11 21:32:13,6501,"So explain how TARP applies here, it closed down in 2011.",1,technology
jbuqodr,11nw54y,2023-03-11 21:38:30,chicknorris76,So many posts by clowns who know nothing about the repercussions of this.  My heart and prayers go out to you and everyone involved (which eventually will be… everyone.),2,wallstreetbets
jbuqrtw,11nx7eq,2023-03-11 21:39:11,oarabbus,"It only works until it doesn't. England used to be the house and the Pound was the reserve currency.

The DXY has been doing well lately, but if the Fed cuts rates and/or prints more like some here are suggesting, all of a sudden the Euro looks a lot more appealing.",1,investing
jbur10b,11nuku9,2023-03-11 21:41:04,M3g4d37h,"&gt; A bank no one ever heard of 

Just because some random-ass internet person doesn't know SVB doesn't mean shit. You wouldn't know who they are most likely because they aren't in your wheelhouse, but your ignorance isn't my circus.

People doing shit and with money know them and do business with them here. I'm a local so I've heard rumblings from a few friends, just like I'm sure you hear shit about stuff in your random-ass town.

/r/confidentlyincorrect",1,finance
