id,post_id,timestamp,author,text,score,subreddit
j85rhcp,10z3ovm,2023-02-11 21:02:48,Orbitkid1,"Should have threw it all in  Lyft puts, could have been a billionaire",1,wallstreetbets
j85rt4h,10z3ovm,2023-02-11 21:05:09,ip_address_freely,But he has 180k lol,1,wallstreetbets
j85sas6,10z3ovm,2023-02-11 21:08:39,PinkyStinkyWinky001,What are the set of rules you’re following if you don’t mind?,1,wallstreetbets
j85sbv3,10z3ovm,2023-02-11 21:08:52,Echoshot21,"I've been doing that with 300.00 usd since Dec. Currently up 1400% (300 to 4100). I'll make a few plays, bring account to say 1-2k and then pull profits back to 300-500.

3600 back in checking already.",7,wallstreetbets
j85uph4,10z3ovm,2023-02-11 21:26:18,robbinhood69,"it's completely true tho, i had the first thought

how is putting the money out of his brokerage gonna keep OP from transferring it back

OP's got demons to grapple with, it's clear to any of his that have had our own (myself included, and i imagine homie who is posting the scathing comments is thinking the same)",8,wallstreetbets
j85uwgz,10z3ovm,2023-02-11 21:27:46,robbinhood69,"i had hte same thought dude

it's not like transferring the money solves any of OP's problems, it just gives him a small 30 second delay while he clicks transfer

i wish u the best OP u hvae some demons homie, it's ok, i do too, if u ever wanna talk reach out i've done some similarly wild shit it is what it is, i do think these demons can be deal with tho but u gotta grapple with them to solve anything",1,wallstreetbets
j85vnr1,10z3ovm,2023-02-11 21:33:24,IMeanIGuess3,How the fuck does someone make and lose that much money? I have 700 dollars in Robinhood. I don’t even know how to gamble it away that fast.,1,wallstreetbets
j85xo98,10z3ovm,2023-02-11 21:48:17,Drew-Money,You have a really high income. Focus most of your money on long term investments and gamble a small portion of your income.,1,wallstreetbets
j85zoit,10z3ovm,2023-02-11 22:03:11,BllsonStll,781K to 180K ![img](emote|t5_2th52|4271),1,wallstreetbets
j85zt44,10z3ovm,2023-02-11 22:04:10,Background_Degree234,![img](emote|t5_2th52|4640),1,wallstreetbets
j8628b4,10z3ovm,2023-02-11 22:22:17,TU_NYCE,What's the all time button show? So are you winning now?,1,wallstreetbets
j8640r3,10z3ovm,2023-02-11 22:35:42,nomad3218,Make sure to stick with your plan it sounds good but this time around I would take profits whenever you can. Good luck,1,wallstreetbets
j8648ye,10z3ovm,2023-02-11 22:37:25,steveinid,"The most important part of your post, to me, was you came back with “…a set of rules”. What are those rules?",1,wallstreetbets
j865q0u,10z3ovm,2023-02-11 22:48:33,FartFuckington69,Do you have any good info for a beginner looking to learn options trading?,1,wallstreetbets
j867sn3,10z3ovm,2023-02-11 23:04:08,Sandiegoman99,Underrated Silicon Valley quote,1,wallstreetbets
j867xc8,10z3ovm,2023-02-11 23:05:09,Sandiegoman99,Options should be no more than 10%.  Sell covered calls people!!!!,1,wallstreetbets
j86fy90,10z3ovm,2023-02-12 00:05:13,weebz69,"I bought $15.50s when it was like $18s just a few days ago, mine expire on the 17th so hope their earnings are crap and hope CPI is higher than expected but I doubt it",2,wallstreetbets
j86hak4,10z3ovm,2023-02-12 00:15:29,MLXIII,7% is very low...,1,wallstreetbets
j86mluv,10z3ovm,2023-02-12 00:56:57,NotlimShot,Rock On!,1,wallstreetbets
j86o2yx,10z3ovm,2023-02-12 01:08:36,pw7090,"Sadly, more like 1 day.",3,wallstreetbets
j86odj1,10z3ovm,2023-02-12 01:10:54,pw7090,"I like the ""slowly build my life back"" part when they clearly traded a shitload of short term options these last 2 weeks.",3,wallstreetbets
j86ofss,10z3ovm,2023-02-12 01:11:24,maddrb,This is beautiful.  Congratulations.  After $750 to 0... this is redemption.,1,wallstreetbets
j86ox0v,10z3ovm,2023-02-12 01:15:13,pw7090,"Wish I was you.

I blew 3 years of savings in a couple of months and was never even up.

I realized I cannot make it back. Losing a bunch of coin flips doesn't make my odds of winning multi-baggers any higher.

The only thing left to do is save and invest for the long term.

Maybe you're much better than me but any kind of gains that substantially beat the S&amp;P are not sustainable. You'll hit zero eventually thinking you can outsmart the market.",1,wallstreetbets
j86p5wc,10z3ovm,2023-02-12 01:17:10,pw7090,"He makes great money for any age, in any country in the world.

Honestly, I think he needs to take a step back and realize how lucky he is just to be in that kind of a position right now and not take it for granted.",1,wallstreetbets
j86q4ix,10z3ovm,2023-02-12 01:24:45,pw7090,"So many stories of ""I was up $500k"" then lost it all.

Man, I saved for years to deposit $25k and got bored after playing it safe with index funds. Was only ever up about $2k before I drove my account to $0.

I have a feeling we just don't hear as much from the people like me who never hit a crazy high before losing it all.",1,wallstreetbets
j86qfgk,10z3ovm,2023-02-12 01:27:08,Daytraderjoey,I'm still technically up but it's a lot harder to read the flow when less people playing.,1,wallstreetbets
j86qrhf,10z3ovm,2023-02-12 01:29:44,CloudSuch9849,I opened up a tire shop. Over 2+ million in sales a year now. No college degree. Gotta work for yourself!,0,wallstreetbets
j86qvdg,10z3ovm,2023-02-12 01:30:35,fen-q,"Not in mechanical.

Software? Yes
Electrical, chemical, computer? Possibly",1,wallstreetbets
j86s1kx,10z3ovm,2023-02-12 01:39:49,bluegill1313,That's what I'm doing.  Literally trying to make 200-300 bucks a day.,6,wallstreetbets
j86wac1,10z3ovm,2023-02-12 02:14:23,gaurav0792,"Bruh, the taxes on that 750k gain probably ate him alive !",1,wallstreetbets
j86yu2x,10z3ovm,2023-02-12 02:35:10,lawlsn,do you put all your money in a trade at one go? it looks like so.,1,wallstreetbets
j86zy18,10z3ovm,2023-02-12 02:44:06,CoffeeTofee,"Jesus, here I am down 96% luck hasn't been on my side for some time now. I'm thinking about just throwing in the towel",1,wallstreetbets
j871mcx,10z3ovm,2023-02-12 02:58:02,ChrisBenQ,Retire so can have that job tf,1,wallstreetbets
j87327a,10z3ovm,2023-02-12 03:10:28,TheSagePhoenix,Can you teach me the ways?,1,wallstreetbets
j8741s4,10z3ovm,2023-02-12 03:19:09,ichosetobehere,I like how you claim only step 1 was pure luck,1,wallstreetbets
j8748mb,10z3ovm,2023-02-12 03:20:49,ichosetobehere,How much are you socking away for taxes?,1,wallstreetbets
j876s3d,10z3ovm,2023-02-12 03:42:50,NotMimir,One might say shitadel level of impressive,1,wallstreetbets
j876ut6,10z3ovm,2023-02-12 03:43:30,NotMimir,What color is your Bugatti?,1,wallstreetbets
j876xsd,10z3ovm,2023-02-12 03:44:13,impeislostparaboloid,Yes this sounds like how humans should be spending their time. God I hate the stock market.,1,wallstreetbets
j87b2i4,10z3ovm,2023-02-12 04:20:31,Visible_Rice1777,Wow. Amazing.,1,wallstreetbets
j87d8s9,10z3ovm,2023-02-12 04:40:41,kungpaocheese,"Which one? The daily driver, the weekend one, or the one your wife likes to ride in?",2,wallstreetbets
j87dbhd,10z3ovm,2023-02-12 04:41:25,MetalliTooL,Don't give us hope.  We're never making it back.  You're just encouraging us to try again and lose even more.,1,wallstreetbets
j87gi37,10z3ovm,2023-02-12 05:12:25,C-Live-11,Start posting on your weeklies so I can moon with you!,1,wallstreetbets
j87h1b3,10z3ovm,2023-02-12 05:17:50,NotMimir,does it matter?,0,wallstreetbets
j87itkv,10z3ovm,2023-02-12 05:36:36,awesometim1,All this to say you lose money,0,wallstreetbets
j87m1uj,10z3ovm,2023-02-12 06:09:10,Moist_Lunch_5075,"You're 23, you live with your parents, you somehow swung a cybersecurity education 3 years ago into a $67k job (which is really low for that space right now) and your most recent job experience you mention is being an UberEATS driver.  You had to go to r/dividends 3 months ago to ask for advice... building a dividend portfolio. ROFL

You had to ask advice... for a dividend portfolio.

Go to your room. LOL

There are three types of people on this sub:

1. People who trade and have some losses in their trading history.
2. People who talk shit and try to hide their massive losses, and they always have massive losses. Like the dude the other day talking crap to me about TA who blew his entire life savings of $220k playing yolos... of course, I only found that after crawling their comment history. 
3. People who don't trade and are here to troll.

Real traders have losses. You learn from those losses by reflecting on them. That's how this game works and anyone pretending otherwise is in group 2 or 3.",1,wallstreetbets
j87sawd,10z3ovm,2023-02-12 07:24:19,ILikeRyzen,congrats and fuck you,1,wallstreetbets
j882i3w,10z3ovm,2023-02-12 09:43:18,S-U_2,Before playing with you 1k what rule's did you set?,1,wallstreetbets
j88a70l,10z3ovm,2023-02-12 11:31:19,red6786,WTF on both your income and asset changes at your age man. Good for you. I’m weirdly impressed at you success and utter degeneracy. I like you Sir.,1,wallstreetbets
j88jg86,10z3ovm,2023-02-12 13:20:39,k986055,okay good luck I am thinking of entering $12 Put on the day of earnings. let's see how it plays out.,2,wallstreetbets
j88jwwx,10z3ovm,2023-02-12 13:25:17,Cokeinmygritz,💀💀 At people actually believing this shit,1,wallstreetbets
j88kkn9,10z3ovm,2023-02-12 13:31:43,weebz69,Come on $9 ![gif](emote|free_emotes_pack|grin),2,wallstreetbets
j88v2ff,10z3ovm,2023-02-12 15:00:47,Disneypup,You never answered where you got the orig 750 from,1,wallstreetbets
j88yobr,10z3ovm,2023-02-12 15:27:36,Zestyclose_Exit_7920,Enterprise Software Sales,2,wallstreetbets
j89drrr,10z3ovm,2023-02-12 17:11:49,No-Criticism3942,everyone knows this executable is malware.,2,wallstreetbets
j89dzix,10z3ovm,2023-02-12 17:13:17,Away_Nefariousness96,I need to be more like you...,1,wallstreetbets
j89k9p8,10z3ovm,2023-02-12 17:55:25,CuteSociety236,Hey can u teach me how turn my 1k to 100k?,1,wallstreetbets
j89l1qq,10z3ovm,2023-02-12 18:00:42,Hefty-Interview4460,"So hum all in all, 750k to 180k ? Is that impressive ?",1,wallstreetbets
j89ladp,10z3ovm,2023-02-12 18:02:20,Hefty-Interview4460,"Try this when you have time: [https://en.wikipedia.org/wiki/The\_Gambler\_(novel)](https://en.wikipedia.org/wiki/The_Gambler_(novel))

I refuse to do any trading, gambling, horse racing bets, sport bets, ANYTHING that relies on chance after having read that. It makes you sick. Dostoevsky fucking had to write the book to pay a gambling debt itself... It was written in 1860 but reading your experience made me feel the same as when I read that book. It might offer you a gutting look in the mirror that might help.",1,wallstreetbets
j89texc,10z3ovm,2023-02-12 18:56:45,nftcreator92,What’s your current trading strategy?,1,wallstreetbets
j89woxn,10z3ovm,2023-02-12 19:18:49,Used-Scheme123,No shot,1,wallstreetbets
j8anj3b,10z3ovm,2023-02-12 22:24:09,Duckboy_Flaccidpus,"He's giving himself a locker-room speech at this point, hoping it sticks.",1,wallstreetbets
j8aobd9,10z3ovm,2023-02-12 22:29:59,Duckboy_Flaccidpus,"Welp, whatever you did that week, if things went your way you'd be sitting on $10M..but they didn't unfortunately.  YOu went for it, and myabe learned something...we'll see.",1,wallstreetbets
j8asikn,10z3ovm,2023-02-12 23:00:53,Coders_REACT_To_JS,"Yeah, mechanical kinda suffers in that department (which sucks given it is an important and difficult field). Not impossible to hop to software if you really need a pay bump. That being said, it’s not for everyone and your happiness should come first imo.",1,wallstreetbets
j8awpn9,10z3ovm,2023-02-12 23:32:07,chaos_was_me,Wot m8,2,wallstreetbets
j8b0sf3,10z3ovm,2023-02-13 00:02:49,fen-q,"I'd love to switch... i discovered coding waaay too late in college and yeah, i fell in love with it instantly.

Now that i've been working, i just dont have the mental capacity to learn after work. I do tons of 3d modeling and my brain is fried at the end of the day to the point i don't even feel like playing a video game, i just want sit on the couch and do nothing. I have lots of admiration for peolle who have managed to learn coding  whether it's python, java, SQL, or whatever while working full time.

I'm in my early 30s as well.... just jealous of people who have achieved so much more at the same age or even younger than i am.",1,wallstreetbets
j8b3o82,10z3ovm,2023-02-13 00:24:24,chaos_was_me,223 years,1,wallstreetbets
j8b3tod,10z3ovm,2023-02-13 00:25:33,chaos_was_me,![img](emote|t5_2th52|4271),1,wallstreetbets
j8bcb75,10z3ovm,2023-02-13 01:27:37,Nervous-Structure725,"During the break, did you further educate yourself on anything specific to change your operative theses?


Since you’re pulling out— great idea: best to not self-manage  (or at least W/o employing some tested generational approach) about 90% plus of your own investing and savings principal (maybe eighty or so if you want to control your own hedging as well as prospecting.)

Are you reserving any capital to purchase shares for expanding your options strategies?

Right now is a very good time to learn about bonds of all kinds…

Good luck",1,wallstreetbets
j8dgl32,10z3ovm,2023-02-13 14:29:19,No-Criticism3942,Listen m9 you cant just be a gay fish without liking fish sticks in your mouth.,1,wallstreetbets
j8e65nc,10z3ovm,2023-02-13 17:29:19,Coders_REACT_To_JS,"It is never too late. A little bit here and there can go a long way. People have joined the software later than you, so you can still do it! :)

The aspect of work taking a lot of your time/energy is a hard one to overcome. Tbh I have no clever solution to this other than maybe taking an easier position while you study. I know that’s not always an option :/",1,wallstreetbets
j8f0q38,10z3ovm,2023-02-13 20:48:54,whomstdth,"This is still $750k to $180k, a $570k loss. But man, we are here for it.",1,wallstreetbets
j8flw6i,10z3ovm,2023-02-13 23:09:10,jhonkas,that's not WSB tho,1,wallstreetbets
j8gea8v,10z3ovm,2023-02-14 02:42:31,Gizmo_51,Congrats. Also fuck you.,1,wallstreetbets
j8l1h9q,10z3ovm,2023-02-15 02:10:02,tfair18,“Don’t want to gamble before CPI” my brother in Christ look how you got here,1,wallstreetbets
j8mfgxw,10z3ovm,2023-02-15 11:35:13,chaos_was_me,"Mnine? 

I'm not spreading malware Meight

Also *No-Criticism3942* don't criticize gay fish bud",2,wallstreetbets
j8mtej0,10z3ovm,2023-02-15 13:51:22,No-Criticism3942,Do you like fish sticks in or around your mouth?,1,wallstreetbets
j8nlnaj,10z3ovm,2023-02-15 17:07:50,chaos_was_me,"I'm not a gay fish, go put your yeezys on and touch grass",1,wallstreetbets
j8psn9b,10z3ovm,2023-02-16 01:59:04,22switch,"Having almost a million dollars liquid and trying to gamble it yourself, as opposed to having it managed, is wild",1,wallstreetbets
j8uz5wm,10z3ovm,2023-02-17 03:15:05,BeastSmitty,I’m freaking woozy…,1,wallstreetbets
j9vjy4g,11asa0d,2023-02-24 21:32:25,Malamonga1,"Are you saying low productivity gains was the cause for low inflation? That sounds inflationary to me, since low productivity would increase unit labor cost and assuming corporate profit margins remains the same, would increase prices.",0,stocks
j9vkfwn,11asa0d,2023-02-24 21:35:38,LegendsLiveForever,"It was global inflation...But sure, 1-2 months max of mortgage rent ($3k), like 2 years ago caused global inflation. *facepalm*",3,stocks
j9vki8b,11asa0d,2023-02-24 21:36:04,LegendsLiveForever,down 30% from summer high...down for 7 months straight.,1,stocks
j9vkwqa,11asa0d,2023-02-24 21:38:41,tangalaporn,At my wife’s clinic they got inflation adjusted raises across the board within her department. Then had reviews and she got another 3% for performance. Non union in the radiology department. Healthcare is doing alright in many departments.,3,stocks
j9vlvpa,11asa0d,2023-02-24 21:45:04,LegendsLiveForever,"Yes, pumping a trillion dollars into the private sector via interest rates (govt is a net payer of them), should definitely slow down inflation. Nothing like pumping $1T into the economy to slow it down. The loan trend should be downwards then, yes, even slightly so if hiking rates effected loans negatively. That is your thesis correct? 

Let's see how 1 year of rate hikes worked on our loan applications: https://ibb.co/64Srz64 

https://twitter.com/patrick_saner/status/1628690771141328897?s=20

Rate hikes increase inflation, and put more money directly in the hands of loan writers. Who increase their income, just like a bond investor might invest in bonds, by writing more loans.",4,stocks
j9vm7zd,11asa0d,2023-02-24 21:47:17,ringo_mogire_beam,50bps all but confirmed now.,1,stocks
j9vobko,11asa0d,2023-02-24 22:00:59,BrooklynButtons,"These figures are not same for everyone else, many are falling rapidly into depts.",9,stocks
j9vosg7,11asa0d,2023-02-24 22:04:08,bootypooop1837,"It takes a long time for interest rates to reflect on inflation. Even if they did a one-point rate increase, it would take many months to take effect. I think .25 is fine. Let's see in 3 months",5,stocks
j9vp2ec,11asa0d,2023-02-24 22:06:01,bobbydebobbob,"You’d be right if I said productivity decreases, but I said (and you repeated) low productivity gains, which doesn’t mean it’s falling. Low gains means a small increase, not a decrease.",2,stocks
j9vpmph,11asa0d,2023-02-24 22:09:49,nysrpatakemyenergy2,"M2 expansion wasn’t 3 grand.

Guess what the global reserve currency is? The dollar. So expansion of dollar supply can cause global inflation",1,stocks
j9vq72y,11asa0d,2023-02-24 22:13:38,DemonBearOP,"I think the Fed isn't dumb and knows high inflation is too dangerous to let continue. The problem is there's limited precedent for this kind of sticky inflation, and it's not clear how high to go or when to stop to avoid deflationary death-spiral.

So the Fed has to be perfect, and they won't be.",1,stocks
j9vqhzc,11asa0d,2023-02-24 22:15:41,Revolutionary_Lie539,Why pay off loans? There is no debtor's prison. BTW Im debtless.,1,stocks
j9vs0y3,11asa0d,2023-02-24 22:26:12,NewImportance8313,"Honestly I don't see the inflation trend breaking until they weaken the labor market. The large retirements in the beginning of the pandemic, drop off in immigration and aging of the population. Suggests to me that essentially the economy is at capacity. Which to be safe implies they need to drop demand at least a little bit below maximum capacity. Therefore I don't see them stopping raising rates till the labor market weakens. That said I would still DCA.",1,stocks
j9vs61e,11asa0d,2023-02-24 22:27:09,WilsonAnders,Send Rinaldo back to U.S. 🤫,1,stocks
j9vs9n0,11asa0d,2023-02-24 22:27:50,FireSparrowWelding,Gotta let their bro's get their record profits locked down first.,2,stocks
j9vsdbj,11asa0d,2023-02-24 22:28:32,purplebrown_updown,Agreed.,1,stocks
j9vsp7h,11asa0d,2023-02-24 22:30:49,Malamonga1,LowER productivity gains also increase inflation.,-1,stocks
j9vth0v,11asa0d,2023-02-24 22:36:09,myhipsi,"Pain? If rates, say,  have to go to double digits for a significant length of time, there will be a debt collapse the likes of which has never been seen in the history of the world. The Fed (and the government) will not let that happen, they will instead allow inflation to continue on for decade(s) if need be. The poor and middle class who are living paycheck to paycheck will get destroyed while everyone else who owns significant assets will be fine as their wealth grows with inflation. I think it's going to be a shit show either way but it'll be a slower, gentler, more dragged out shit show if they allow inflation to continue.",6,stocks
j9vuols,11asa0d,2023-02-24 22:44:28,Masterlyn,Then she/he will have the opportunity to DCA at ATH prices.,0,stocks
j9vxntq,11asa0d,2023-02-24 23:05:18,gsasquatch,"Housing had a higher than most jump

https://apps.bea.gov/iTable/?reqid=19&amp;step=3&amp;isuri=1&amp;select_all_years=0&amp;nipa_table_list=2013&amp;series=m&amp;first_year=2020&amp;last_year=2022&amp;scale=-99&amp;categories=underlying&amp;thetable=

Did it jump because the fed rates are going up?  Is their effort to curb inflation what is causing the inflation, if some of the other stuff isn't going up as much?",1,stocks
j9vzjs8,11asa0d,2023-02-24 23:18:46,tookmyname,"Yes, that is how inflation numbers work. Indeed.",-1,stocks
j9vzpie,11asa0d,2023-02-24 23:19:54,tookmyname,Spreading out the bad news.,0,stocks
j9w20c7,11asa0d,2023-02-24 23:36:24,modsBan4Fub,I just want better entry points let it all crash,1,stocks
j9w2625,11asa0d,2023-02-24 23:37:32,datcommentator,"It’s more than clear at this point that we need The Rock in the White House. Meanwhile, Vice President McMahon will whip Congress into shape “because of the implication.”",1,stocks
j9w26bb,11asa0d,2023-02-24 23:37:35,LegendsLiveForever,"Why are you even arguing when you know nothing about what you speak of? 

Inflation isn't a measure of the value of the dollar *facepalm* It measures what producers...etc are charging. 


All the inflationista's who were screaming, ""money printing"" is causing inflation. Money supply is contracting by a record amount. Yet inflation is still hot. Why are they not screaming ""deflation, deflation?"" 

M2: https://ibb.co/PmbLdsZ

Because they are just parroting what what they heard on the news, or from a pundit, and don't have any idea how this stuff actually works.",3,stocks
j9w4c6e,11asa0d,2023-02-24 23:53:19,Tzokal,I love when markets drop because then I can buy some good stocks at a discount 🤷🏻‍♂️,1,stocks
j9w4lzk,11asa0d,2023-02-24 23:55:15,salahelbat,messi plays through blood lol what,4,stocks
j9w5bdo,11asa0d,2023-02-25 00:00:25,nostratic,and to think people downvoted me a few months ago for linking to that article where Rob Arnott estimated inflation would keep rising...,1,stocks
j9w6em9,11asa0d,2023-02-25 00:08:26,alvaroga91,What do they win doing that?,2,stocks
j9w6gv2,11asa0d,2023-02-25 00:08:53,alvaroga91,Why would he do that?,6,stocks
j9w783c,11asa0d,2023-02-25 00:14:26,boredhuman1234,I don’t know how people survived the 70s with 9 straight years of over 5% annual inflation.,4,stocks
j9w79en,11asa0d,2023-02-25 00:14:42,Minions89,Let it crash. Give me the discount 🤩,1,stocks
j9w7y9n,11asa0d,2023-02-25 00:19:49,boredhuman1234,"Stop dooming, it’s not like stocks will never go up again. Stocks went up when rates were 5, 10, even 15%. They’ll go up again eventually, even if there is a correction beforehand.",8,stocks
j9w838a,11asa0d,2023-02-25 00:20:50,DoctorJonZoidberg,People who say things like “WMA” and “tested” are donkeys trying to interpret astrology,5,stocks
j9w8iz7,11asa0d,2023-02-25 00:24:02,kippypapa,"I asked my dad about it once - the huge recession, inflation. He said most people were fine. I think seniors had it hardest. Imagine your whole life, houses were under $20k and then they were in the hundreds of thousands by the end of the decade. Many were on fixed income and finding an affordable rental was hard.",2,stocks
j9w9pfs,11asa0d,2023-02-25 00:32:48,95Daphne,"If it's related to what I think CPI is related to, the data is simply delayed so darn badly.

It's so bad that it's quite possible that everyone gets their loins lathered up on higher for longer and then get rugged later this spring similarly to November 10th again because of us being too off balance (too short on bonds, and too short on tech).",1,stocks
j9wa3kq,11asa0d,2023-02-25 00:35:45,herrrrrr,key inflation measure lmao.,0,stocks
j9wag8z,11asa0d,2023-02-25 00:38:21,36Taylor36,"Yup my Aunt owns 3 apartments and she raised rent about 25%. She won't lower it ever, unless the housing market comes down and new people move in.",1,stocks
j9wbi7f,11asa0d,2023-02-25 00:46:08,therapist122,"A lot of people can spell Pennsylvania, hell I bet Hitler could spell Pennsylvania. Seems like a kinda low bar if it applies to Hitler. Without mentioning fetterman even indirectly, why would someone vote for oz",3,stocks
j9wd2wu,11asa0d,2023-02-25 00:58:04,unknownpanda121,I don’t see how it’s a cope. If you’re holding for 20-30 years red days now are good. Market growth will happen over time. This is r/stocks not r/wallstreetbets.,1,stocks
j9wdt8z,11asa0d,2023-02-25 01:03:39,MelancholyKoko,"Growing up I always thought teachers were well compensated (spent time abroad and grew up in NJ). 

But wow did my perspective change when I first moved to north TX. I wondered how these teachers supported themselves with barely minimum wage pay.",6,stocks
j9we8zq,11asa0d,2023-02-25 01:07:00,LanceX2,Its awful. Inflation is a bitch. Saving enough to max two Roths is hard,1,stocks
j9weh0i,11asa0d,2023-02-25 01:08:41,WishyRater,Time for a strike,1,stocks
j9wejau,11asa0d,2023-02-25 01:09:10,AnonUserAccount,"I have posted on here before about how I use seasonality to help guide my timing in/out of the market. Seasonally speaking (since 1950), the second half of Feb and the first week in March are terrible for equities. I used to go all cash, but I decided just this year to use inverse ETFs instead. Shit, I’m already betting the market will go down, which is why I exit equities to cash, so might as well go all in and bet an inverse ETF. 

This is my first time using this strategy. I didn’t want to move all my money into the SQQQ, so I invested about 10% of my 401K, and left 90% in cash.",1,stocks
j9wekn2,11asa0d,2023-02-25 01:09:25,WishyRater,Strike,1,stocks
j9wew25,11asa0d,2023-02-25 01:11:52,WishyRater,I genuinely dont think there’s political will to hit the hammer harder. Someone like Paul Volcker would legit get booted in a flash today,1,stocks
j9wewm4,11asa0d,2023-02-25 01:11:59,LanceX2,"No unions and Oklahoma strikes arent allowed. They did an approved walkout and went from 30K to 36K in 2018.

Gsrbage pay",1,stocks
j9wf8d8,11asa0d,2023-02-25 01:14:28,WishyRater,No unions? For TEACHERS? How is that possible,1,stocks
j9wgzhz,11asa0d,2023-02-25 01:28:02,LanceX2,"
the ""union"" has no power in Oklahoma. Cant Strike. cant Lobby really. Its mostly a way to get lawyer help. thats it",1,stocks
